Archived 2022 Vods
==================


January 2022
-------------

* [1.1.22] - `2022 01 01 LOW TIER GOD LIVE STREAM %F0%9F%9B%91 NEW YEAR CHAT CLOUT GONE MAYBE TWITCH (1_1_2022) 2022 01 02 01_35 3Hqs_f7v wc :f <https://odysee.com/@pneuth:b/-2022-01-01--LOW-TIER-GOD-LIVE-STREAM-%F0%9F%9B%91-NEW-YEAR-CHAT-CLOUT-GONE-MAYBE-TWITCH--(1_1_2022)-2022-01-02-01_35--3Hqs_f7v-wc-:f>`_ 

* [1.3.22] - `2022 01 02 LOWTI3RGOD (live) 2022 01 03 02_03 45007517837 :f <https://odysee.com/@pneuth:b/-2022-01-02--LOWTI3RGOD-(live)-2022-01-03-02_03--45007517837-:f>`_

* [V2, more content] - `LowTierGod (LTG) Dale  Stream 1_3_2022 cMG4hSV aY4  FIXED :7 <https://odysee.com/@Dr.BroadwayMk.III:a/LowTierGod-(LTG)-Dale---Stream-1_3_2022--cMG4hSV-aY4---FIXED-:7>`_

* [1.4.22] - `LowTierGod (LTG) Dale  Stream 1_4_2022 JUR2XWPTvb8  FIXED :a <https://odysee.com/@Dr.BroadwayMk.III:a/LowTierGod-(LTG)-Dale---Stream-1_4_2022--JUR2XWPTvb8---FIXED-:a>`_

* [1.5.22] - `2022 01 05 LOW TIER GOD LIVE STREAM %F0%9F%9B%91 TOPICS THE TWITCH (1_5_2022) 2022 01 05 22_24 URdPLYQrYrk :3 <https://odysee.com/@pneuth:b/-2022-01-05--LOW-TIER-GOD-LIVE-STREAM-%F0%9F%9B%91-TOPICS-THE-TWITCH--(1_5_2022)-2022-01-05-22_24--URdPLYQrYrk-:3>`_

* [V2, more content] - `LowTierGod (LTG) Dale  Stream 1_5_2022 17wCXESYfa0  FIXED :6 <https://odysee.com/@Dr.BroadwayMk.III:a/LowTierGod-(LTG)-Dale---Stream-1_5_2022--17wCXESYfa0---FIXED-:6>`_

* [1.6.22] - `2022 01 06 LOW TIER GOD LIVE STREAM %F0%9F%9B%91 NO TOPICS_GO GREEN THEN TWITCH (1_6_2022) 2022 01 06 23_38 vozbwT9BWFM :3 <https://odysee.com/@pneuth:b/-2022-01-06--LOW-TIER-GOD-LIVE-STREAM-%F0%9F%9B%91-NO-TOPICS_GO-GREEN-THEN-TWITCH--(1_6_2022)-2022-01-06-23_38--vozbwT9BWFM-:3>`_

[1.6.22]

* [https://odysee.com/@pneuth:b/-2022-01-05--LOWTI3RGOD-(live)-2022-01-06-01_28--39322024809-:8] - `2022 01 05 LOWTI3RGOD (live) 2022 01 06 01_28 39322024809 :8 <https://odysee.com/@pneuth:b/-2022-01-05--LOWTI3RGOD-(live)-2022-01-06-01_28--39322024809-:8>`_

* [V2, more content] - `LowTierGod (LTG) Dale  Stream 1_6_2022 (Part 1) G8y5TBKNVWM  FIXED :2 <https://odysee.com/@Dr.BroadwayMk.III:a/LowTierGod-(LTG)-Dale---Stream-1_6_2022-(Part-1)--G8y5TBKNVWM---FIXED-:2>`_

* [https://odysee.com/@Dr.BroadwayMk.III:a/LowTierGod-(LTG)-Dale---Stream-1_6_2022-(Part-2)--x4JxwXJaMk0---FIXED-:7] - `LowTierGod (LTG) Dale  Stream 1_6_2022 (Part 2) x4JxwXJaMk0  FIXED :7 <https://odysee.com/@Dr.BroadwayMk.III:a/LowTierGod-(LTG)-Dale---Stream-1_6_2022-(Part-2)--x4JxwXJaMk0---FIXED-:7>`_

* [1.7.22] - `2022 01 07 LOW TIER GOD LIVE STREAM %F0%9F%9B%91 NO TOPICS_GO GREEN THEN TWITCH (1_7_2022) 2022 01 07 23_49 V7KIRrSn JA :5 <https://odysee.com/@pneuth:b/-2022-01-07--LOW-TIER-GOD-LIVE-STREAM-%F0%9F%9B%91-NO-TOPICS_GO-GREEN-THEN-TWITCH--(1_7_2022)-2022-01-07-23_49--V7KIRrSn-JA-:5>`_

* [V2, more content] - `LowTierGod (LTG) Dale  Stream 1_7_2022 yRL5mrEi_Eg  FIXED :1 <https://odysee.com/@Dr.BroadwayMk.III:a/LowTierGod-(LTG)-Dale---Stream-1_7_2022--yRL5mrEi_Eg---FIXED-:1>`_

* [1.9.22] - `2022 01 09 LOW TIER GOD LIVE STREAM %F0%9F%9B%91 NO TOPICS_GO GREEN THEN TWITCH (1_9_2022) d55625749153374fcc6eb07540658133de30d7cc  UkoX u7Z8jY :5 <https://odysee.com/@pneuth:b/-2022-01-09--LOW-TIER-GOD-LIVE-STREAM-%F0%9F%9B%91-NO-TOPICS_GO-GREEN-THEN-TWITCH-(1_9_2022)--d55625749153374fcc6eb07540658133de30d7cc---UkoX-u7Z8jY-:5>`_

* [1.11.22] - `2022 01 11 LOW TIER GOD LIVE STREAM %F0%9F%9B%91 GAMES_GO GREEN_THEN TWITCH (1_11_2022) 2022 01 11 21_44 YQwINPdTZUQ :f <https://odysee.com/@pneuth:b/-2022-01-11--LOW-TIER-GOD-LIVE-STREAM-%F0%9F%9B%91-GAMES_GO-GREEN_THEN-TWITCH--(1_11_2022)-2022-01-11-21_44--YQwINPdTZUQ-:f>`_

* [1.11.22] - `2022 01 11 LOW TIER GOD LIVE STREAM %F0%9F%9B%91 GAMES_GO GREEN_THEN TWITCH (1_11_2022) 7f4156ee0c7f41108cf2cea8c732e2c6ea33eecf  YQwINPdTZUQ :2 <https://odysee.com/@pneuth:b/-2022-01-11--LOW-TIER-GOD-LIVE-STREAM-%F0%9F%9B%91-GAMES_GO-GREEN_THEN-TWITCH--(1_11_2022)--7f4156ee0c7f41108cf2cea8c732e2c6ea33eecf---YQwINPdTZUQ-:2>`_

* [V2, more content MASSIVE 7HR STREAM] - `GNC Stream  1_11_2022 DsrsSnlhgdI  FIXED :9 <https://odysee.com/@Dr.BroadwayMk.III:a/GNC-Stream---1_11_2022--DsrsSnlhgdI---FIXED-:9>`_

* [1.12.22] - `2022 01 12 LOWTI3RGOD (live) 2022 01 12 01_44 45116578941 :b <https://odysee.com/@pneuth:b/-2022-01-12--LOWTI3RGOD-(live)-2022-01-12-01_44--45116578941-:b>`_

* [1.13.22] - `2022 01 13 LOW TIER GOD LIVE STREAM %F0%9F%9B%91 GO GREEN THEN TWITCH (1_13_2022) 93921e31537779e0ab99d5b3ce157ff85db42481  _w9hXbrYGAQ :5 <https://odysee.com/@pneuth:b/-2022-01-13--LOW-TIER-GOD-LIVE-STREAM-%F0%9F%9B%91-GO-GREEN-THEN-TWITCH-(1_13_2022)--93921e31537779e0ab99d5b3ce157ff85db42481---_w9hXbrYGAQ-:5>`_

* [V2, more content] - `GNC Stream 1_13_2022 P600fgQzGdc  FIXED :0 <https://odysee.com/@Dr.BroadwayMk.III:a/GNC-Stream-1_13_2022--P600fgQzGdc---FIXED-:0>`_

* [1.14.22] - `2022 01 14 LOW TIER GOD LIVE STREAM %F0%9F%9B%91 TOPICS_GO GREEN THEN TWITCH (1_14_2022) 859f6c5c8abf11a21a79d2c7766160cb2c73ae7c  SGre3O6N9Dk :c <https://odysee.com/@pneuth:b/-2022-01-14--LOW-TIER-GOD-LIVE-STREAM-%F0%9F%9B%91-TOPICS_GO-GREEN-THEN-TWITCH-(1_14_2022)--859f6c5c8abf11a21a79d2c7766160cb2c73ae7c---SGre3O6N9Dk-:c>`_

* [V2, more content] - `GNC Stream 1_14_2022 mfT820mg7vg  FIXED :d <https://odysee.com/@Dr.BroadwayMk.III:a/GNC-Stream-1_14_2022--mfT820mg7vg---FIXED-:d>`_

* [1.15.22] - `2022 01 15 LOW TIER GOD LIVE STREAM %F0%9F%9B%91 GAMES_ THATS ALL (1_15_2022) 2022 01 16 00_36 vGezD4enjXs :c <https://odysee.com/@pneuth:b/-2022-01-15--LOW-TIER-GOD-LIVE-STREAM-%F0%9F%9B%91-GAMES_-THATS-ALL-(1_15_2022)-2022-01-16-00_36--vGezD4enjXs-:c>`_

* [1.18.22] - `2022 01 18 LOW TIER GOD LIVE STREAM %F0%9F%9B%91 GAMES_ THEN TWITCH_ SUPORT THE YOUTUBE STREAMS (1_18_2022) 2022 01 18 23_28 taY4ikbFfgc :9 <https://odysee.com/@pneuth:b/-2022-01-18--LOW-TIER-GOD-LIVE-STREAM-%F0%9F%9B%91-GAMES_-THEN-TWITCH_-SUPORT-THE-YOUTUBE-STREAMS--(1_18_2022)-2022-01-18-23_28--taY4ikbFfgc-:9>`_

* [1.19.22] - `2022 01 19 LOW TIER GOD LIVE STREAM %F0%9F%9B%91 GAMES_ THEN TWITCH_ SUPORT THE YOUTUBE STREAMS (1_19_2022) 2022 01 20 01_21 zurDtBg2Zpg :b <https://odysee.com/@pneuth:b/-2022-01-19--LOW-TIER-GOD-LIVE-STREAM-%F0%9F%9B%91-GAMES_-THEN-TWITCH_-SUPORT-THE-YOUTUBE-STREAMS--(1_19_2022)-2022-01-20-01_21--zurDtBg2Zpg-:b>`_

* [1.19.22] - `2022 01 18 LOWTI3RGOD (live) 2022 01 19 02_39 45205074989 :0 <https://odysee.com/@pneuth:b/-2022-01-18--LOWTI3RGOD-(live)-2022-01-19-02_39--45205074989-:0>`_

* [V2, more content] - `GNC Stream 1_19_2022 tvoCG9waPxA  FIXED :f <https://odysee.com/@Dr.BroadwayMk.III:a/GNC-Stream-1_19_2022--tvoCG9waPxA---FIXED-:f>`_

* [1.20.22] - `2022 01 19 LOWTI3RGOD (live) 2022 01 20 03_38 39364262281 :0 <https://odysee.com/@pneuth:b/-2022-01-19--LOWTI3RGOD-(live)-2022-01-20-03_38--39364262281-:0>`_

* [V2, more content] - `LowTierGod (LTG) Dale  Stream 1_7_2022 yRL5mrEi_Eg  FIXED :1 <https://odysee.com/@Dr.BroadwayMk.III:a/LowTierGod-(LTG)-Dale---Stream-1_7_2022--yRL5mrEi_Eg---FIXED-:1>`_

* [1.21.22] - `2022 01 20 LOWTI3RGOD (live) 2022 01 21 01_29 39367216633 :f <https://odysee.com/@pneuth:b/-2022-01-20--LOWTI3RGOD-(live)-2022-01-21-01_29--39367216633-:f>`_

* [V2, more content] - `GNC Stream  1_21_2022 RLHK3z kkEg  FIXED :9 <https://odysee.com/@Dr.BroadwayMk.III:a/GNC-Stream---1_21_2022--RLHK3z-kkEg---FIXED-:9>`_

* [1.22.21] - `GNC Stream  1_22_2022 IQCgq1awXNY  FIXED :8 <https://odysee.com/@Dr.BroadwayMk.III:a/GNC-Stream---1_22_2022--IQCgq1awXNY---FIXED-:8>`_

* [1.23.22] - `2022 01 23 LOW TIER GOD LIVE STREAM %F0%9F%9B%91 GAMES (1_23_2022) 1151f2cff50230585bd745dbb31315566c2c3890  X_j5W54eZPA :3 <https://odysee.com/@pneuth:b/-2022-01-23--LOW-TIER-GOD-LIVE-STREAM-%F0%9F%9B%91-GAMES-(1_23_2022)--1151f2cff50230585bd745dbb31315566c2c3890---X_j5W54eZPA-:3>`_

* [V2, more content] - `GNC Stream  1_23_2022 HZWIjVtzQ44  FIXED :4 <https://odysee.com/@Dr.BroadwayMk.III:a/GNC-Stream---1_23_2022--HZWIjVtzQ44---FIXED-:4>`_

* [1.24.22] - `2022 01 24 LOW TIER GOD LIVE STREAM %F0%9F%9B%91 MONDAY GAMES (1_24_2022) 81f6c7222da9b95a7c76b84b6e60f8674368c4d9  P4SRxdfMC_g :e <https://odysee.com/@pneuth:b/-2022-01-24--LOW-TIER-GOD-LIVE-STREAM-%F0%9F%9B%91-MONDAY-GAMES-(1_24_2022)--81f6c7222da9b95a7c76b84b6e60f8674368c4d9---P4SRxdfMC_g-:e>`_

[1.24.22, 2 parts]

* [https://odysee.com/@pneuth:b/-2022-01-23--LOWTI3RGOD-(live)-2022-01-24-03_49--45268782909-:5] - `2022 01 23 LOWTI3RGOD (live) 2022 01 24 03_49 45268782909 :5 <https://odysee.com/@pneuth:b/-2022-01-23--LOWTI3RGOD-(live)-2022-01-24-03_49--45268782909-:5>`_

* [1.25.22] - `2022 01 25 LOW TIER GOD YOUTUBE LIVE STREAM %F0%9F%9B%91GAMES_TOPICS_JOIN (1_25_2022) 2022 01 26 00_31 FXKp5ytIJD0 :d <https://odysee.com/@pneuth:b/-2022-01-25--LOW-TIER-GOD-YOUTUBE-LIVE-STREAM-%F0%9F%9B%91GAMES_TOPICS_JOIN--(1_25_2022)-2022-01-26-00_31--FXKp5ytIJD0-:d>`_

* [1.25.22] - `2022 01 25 LOWTI3RGOD (live) 2022 01 26 03_59 45292133245 :c <https://odysee.com/@pneuth:b/-2022-01-25--LOWTI3RGOD-(live)-2022-01-26-03_59--45292133245-:c>`_

* [1.27.22] - `2022 01 27 LOW TIER GOD YOUTUBE LIVE STREAM %F0%9F%9B%91GAMES_TOPICS_JOIN FOR NEW EMOTES (1_27_2022) 2022 01 28 00_19 O4l3mjzhcho :c <https://odysee.com/@pneuth:b/-2022-01-27--LOW-TIER-GOD-YOUTUBE-LIVE-STREAM-%F0%9F%9B%91GAMES_TOPICS_JOIN-FOR-NEW-EMOTES--(1_27_2022)-2022-01-28-00_19--O4l3mjzhcho-:c>`_

* [1.28.22] - `2022 01 28 LOW TIER GOD YOUTUBE LIVE STREAM %F0%9F%9B%91GAMES_TOPICS_then_ twitch for strive (1_27_2022) 2022 01 28 22_28 e7NPScRsUrc :7 <https://odysee.com/@pneuth:b/-2022-01-28--LOW-TIER-GOD-YOUTUBE-LIVE-STREAM-%F0%9F%9B%91GAMES_TOPICS_then_-twitch-for-strive-(1_27_2022)-2022-01-28-22_28--e7NPScRsUrc-:7>`_

* [1.28.22] - `2022 01 28 LOWTI3RGOD (live) 2022 01 29 02_45 45330165773 :9 <https://odysee.com/@pneuth:b/-2022-01-28--LOWTI3RGOD-(live)-2022-01-29-02_45--45330165773-:9>`_

* [1.29.21] - `2022 01 29 LOW TIER GOD YOUTUBE LIVE STREAM %F0%9F%9B%91GAMES_TOPICS_then_ twitch (1_29_2022) 2022 01 30 00_34 1OQ5rf4zdV0 :8 <https://odysee.com/@pneuth:b/-2022-01-29--LOW-TIER-GOD-YOUTUBE-LIVE-STREAM-%F0%9F%9B%91GAMES_TOPICS_then_-twitch--(1_29_2022)-2022-01-30-00_34--1OQ5rf4zdV0-:8>`_

* [1.29.22] - `2022 01 29 LOWTI3RGOD (live) 2022 01 30 03_01 45343307165 :c <https://odysee.com/@pneuth:b/-2022-01-29--LOWTI3RGOD-(live)-2022-01-30-03_01--45343307165-:c>`_

* [1.31.22] - `2022 01 31 LOW TIER GOD YOUTUBE LIVE 100k live STREAM set up is not ready! (1_27_2022) 2022 02 01 01_37 NIgw3cJnfj8 :c <https://odysee.com/@pneuth:b/-2022-01-31--LOW-TIER-GOD-YOUTUBE-LIVE-100k-live-STREAM-set-up-is-not-ready!-(1_27_2022)-2022-02-01-01_37--NIgw3cJnfj8-:c>`_

February 2022
-------------

* [2.1.22] - `2022 02 01 Lowti3rgod (Live) 2022 02 02 02 34 45377746909  FIXED AUDIO :2 <https://odysee.com/@pneuth:b/-2022-02-01--Lowti3rgod-(Live)-2022-02-02-02-34--45377746909---FIXED-AUDIO-:2>`_

* [Non-corrupted audio] - `GNC stream  2_1_2022 worBE0JP6TU :3 <https://odysee.com/@Dr.BroadwayMk.III:a/GNC-stream---2_1_2022--worBE0JP6TU-:3>`_

* [2.2.22] - `2022 02 02 LOW TIER GOD YOUTUBE LIVE STREAM %F0%9F%9B%91GAMES (2_2_2022) 2022 02 03 02_02 TizY5pA2VVA :8 <https://odysee.com/@pneuth:b/-2022-02-02--LOW-TIER-GOD-YOUTUBE-LIVE-STREAM-%F0%9F%9B%91GAMES-(2_2_2022)-2022-02-03-02_02--TizY5pA2VVA-:8>`_

* [2.3.22] - `2022 02 03 LOWTI3RGOD (live) 2022 02 04 01_12 45401340045 :5 <https://odysee.com/@pneuth:b/-2022-02-03--LOWTI3RGOD-(live)-2022-02-04-01_12--45401340045-:5>`_

* [V2, more content] - `GNC Stream 2_3_2022 MU40oPNJm6Q  FIXED :7 <https://odysee.com/@Dr.BroadwayMk.III:a/GNC-Stream-2_3_2022--MU40oPNJm6Q---FIXED-:7>`_

* [2.4.22] - `2022 02 04 LOW TIER GOD YOUTUBE LIVE STREAM %F0%9F%9B%91GAMES_reacting to bs comments (2_4_2022) 2f1aeff9e6ed725596a40b777d70a615130d4803  ex67Xrj3OOQ :6 <https://odysee.com/@pneuth:b/-2022-02-04--LOW-TIER-GOD-YOUTUBE-LIVE-STREAM-%F0%9F%9B%91GAMES_reacting-to-bs-comments-(2_4_2022)--2f1aeff9e6ed725596a40b777d70a615130d4803---ex67Xrj3OOQ-:6>`_

* [2.4.21] - `2022 02 04 LOW TIER GOD YOUTUBE LIVE STREAM %F0%9F%9B%91GAMES_reacting to bs comments (2_4_2022) 2022 02 05 03_17 ex67Xrj3OOQ :9 <https://odysee.com/@pneuth:b/-2022-02-04--LOW-TIER-GOD-YOUTUBE-LIVE-STREAM-%F0%9F%9B%91GAMES_reacting-to-bs-comments--(2_4_2022)-2022-02-05-03_17--ex67Xrj3OOQ-:9>`_

* [2.5.22] - `2022 02 05 LOW TIER GOD YOUTUBE LIVE STREAM %F0%9F%9B%91GAMES_topics (2_5_2022) d7fcca440e058674581d06b01b03a6e97fbe8897  3RAqwkrdy78 :1 <https://odysee.com/@pneuth:b/-2022-02-05--LOW-TIER-GOD-YOUTUBE-LIVE-STREAM-%F0%9F%9B%91GAMES_topics-(2_5_2022)--d7fcca440e058674581d06b01b03a6e97fbe8897---3RAqwkrdy78-:1>`_

* [2.8.22] - `2022 02 08 LOW TIER GOD YOUTUBE LIVE STREAM %F0%9F%9B%91GAMES_topics_ then twitch (2_8_2022) e1415f288ca2b22325a9d32833a7b43b44e3ed2c  fhfQ4 8UXnk :b <https://odysee.com/@pneuth:b/-2022-02-08--LOW-TIER-GOD-YOUTUBE-LIVE-STREAM-%F0%9F%9B%91GAMES_topics_-then-twitch-(2_8_2022)--e1415f288ca2b22325a9d32833a7b43b44e3ed2c---fhfQ4-8UXnk-:b>`_

* [2.8.22] - `2022 02 08 LOW TIER GOD LIVE STREAM (02_09_22) (Twitch) de94c44511ac24ad058f6a8104e2944745b34ee8 :4 <https://odysee.com/@pneuth:b/-2022-02-08--LOW-TIER-GOD-LIVE-STREAM-(02_09_22)-(Twitch)--de94c44511ac24ad058f6a8104e2944745b34ee8-:4>`_

* [2.10.22] - `2022 02 10 LOW TIER GOD LIVE STREAM %F0%9F%9B%91GAMES_topics_ then twitch (2_10_22) fbee59bd758d0035c7356cf0e69a711db459be98  6mlLdTkNQ4U :8 <https://odysee.com/@pneuth:b/-2022-02-10--LOW-TIER-GOD-LIVE-STREAM-%F0%9F%9B%91GAMES_topics_-then-twitch-(2_10_22)--fbee59bd758d0035c7356cf0e69a711db459be98---6mlLdTkNQ4U-:8>`_

* [2.10.22] - `2022 02 10 LOWTI3RGOD (live) 2022 02 11 03_13 45485548269 :0 <https://odysee.com/@pneuth:b/-2022-02-10--LOWTI3RGOD-(live)-2022-02-11-03_13--45485548269-:0>`_

* [2.11.22] - `2022 02 11 Lowti3rgod (Live) 2022 02 12 00 56 45497241837  AUDIO FIXED :a <https://odysee.com/@pneuth:b/-2022-02-11--Lowti3rgod-(Live)-2022-02-12-00-56--45497241837---AUDIO-FIXED-:a>`_

* [Non-corrupted Audio] - `GNC Stream  2_11_2022 bP6KG9c8xY8 :d <https://odysee.com/@Dr.BroadwayMk.III:a/GNC-Stream---2_11_2022--bP6KG9c8xY8-:d>`_

* [2.12.22] - `2022 02 12 Lowti3rgod (Live) 2022 02 13 02 24 45511176141  FIXED AUDIO :6 <https://odysee.com/@pneuth:b/-2022-02-12--Lowti3rgod-(Live)-2022-02-13-02-24--45511176141---FIXED-AUDIO-:6>`_

* [Non-corrupted audio] - `GNC Stream  2_12_2022 N9JTFBxil68 :6 <https://odysee.com/@Dr.BroadwayMk.III:a/GNC-Stream---2_12_2022--N9JTFBxil68-:6>`_

* [2.13.22] - `2022 02 13 LOW TIER GOD YOUTUBE LIVE STREAM %F0%9F%9B%91GAMES_etc_ then twitch (2_13_2022) nPpmr472UNw :d <https://odysee.com/@pneuth:b/-2022-02-13--LOW-TIER-GOD-YOUTUBE-LIVE-STREAM-%F0%9F%9B%91GAMES_etc_-then-twitch-(2_13_2022)--nPpmr472UNw-:d>`_

* [2.14.22] - `2022 02 14 LOW TIER GOD YOUTUBE LIVE STREAM %F0%9F%9B%91 KOF_topics_ then twitch (2_14_2022) 3ece6c9d013bb674286157b012c81bb630c1e00c  OezYVPkDLHU :e <https://odysee.com/@pneuth:b/-2022-02-14--LOW-TIER-GOD-YOUTUBE-LIVE-STREAM-%F0%9F%9B%91-KOF_topics_-then-twitch-(2_14_2022)--3ece6c9d013bb674286157b012c81bb630c1e00c---OezYVPkDLHU-:e>`_

* [2.14.22] - `2022 02 14 LOWTI3RGOD (live) 2022 02 15 01_13 45533125645 :b <https://odysee.com/@pneuth:b/-2022-02-14--LOWTI3RGOD-(live)-2022-02-15-01_13--45533125645-:b>`_

* [2.16.22] - `2022 02 16 LOW TIER GOD YOUTUBE LIVE STREAM %F0%9F%9B%91 KOF_games_ then twitch (2_16_2022) VCwFN1GX3a0 :6 <https://odysee.com/@pneuth:b/-2022-02-16--LOW-TIER-GOD-YOUTUBE-LIVE-STREAM-%F0%9F%9B%91-KOF_games_-then-twitch-(2_16_2022)--VCwFN1GX3a0-:6>`_

[2.16.22, 5 parts]

* [https://odysee.com/@pneuth:b/-2022-02-16--LOWTI3RGOD-(live)-2022-02-17-03_43--45556606237-:2] - `2022 02 16 LOWTI3RGOD (live) 2022 02 17 03_43 45556606237 :2 <https://odysee.com/@pneuth:b/-2022-02-16--LOWTI3RGOD-(live)-2022-02-17-03_43--45556606237-:2>`_

* [https://odysee.com/@pneuth:b/-2022-02-16--LOWTI3RGOD-(live)-2022-02-17-04_02--45556699437-:d] - `2022 02 16 LOWTI3RGOD (live) 2022 02 17 04_02 45556699437 :d <https://odysee.com/@pneuth:b/-2022-02-16--LOWTI3RGOD-(live)-2022-02-17-04_02--45556699437-:d>`_

* [https://odysee.com/@pneuth:b/-2022-02-16--LOWTI3RGOD-(live)-2022-02-17-04_43--45556893853-:d] - `2022 02 16 LOWTI3RGOD (live) 2022 02 17 04_43 45556893853 :d <https://odysee.com/@pneuth:b/-2022-02-16--LOWTI3RGOD-(live)-2022-02-17-04_43--45556893853-:d>`_

* [https://odysee.com/@pneuth:b/-2022-02-16--LOWTI3RGOD-(live)-2022-02-17-04_43--45556893853-:d] - `2022 02 16 LOWTI3RGOD (live) 2022 02 17 04_43 45556893853 :d <https://odysee.com/@pneuth:b/-2022-02-16--LOWTI3RGOD-(live)-2022-02-17-04_43--45556893853-:d>`_

* [2.17.22] - `2022 02 17 LOW TIER GOD YOUTUBE LIVE STREAM topics then twitch (2_17_2022) bf4f5d3f2dadfe44446e871a707b5afe7dec0ae1 <https://odysee.com/@pneuth:b/-2022-02-17--LOW-TIER-GOD-YOUTUBE-LIVE-STREAM-%F0%9F%9B%91_topics_-then-twitch-(2_17_2022)--bf4f5d3f2dadfe44446e871a707b5afe7dec0ae1---BM6NcC4qAks-:0>`_

* [Non-corrupted Audio MASSIVE 7HR STREAM] - `GNC Stream  2_17_2022 kh3lhMe1mFM <https://odysee.com/@Dr.BroadwayMk.III:a/GNC-Stream---2_17_2022--kh3lhMe1mFM-:c>`_

* [2.17.22] - `2022 02 17 LOWTI3RGOD (live) 2022 02 18 02 03 <https://odysee.com/@pneuth:b/-2022-02-17--LOWTI3RGOD-(live)-2022-02-18-02_03--45567796093-:5>`_

* [2.17.22] - `2022 02 17 Lowti3rgod (Live) 2022 02 18 02 03 FIXED AUDIO <https://odysee.com/@pneuth:b/-2022-02-17--Lowti3rgod-(Live)-2022-02-18-02-03--45567796093---FIXED-AUDIO-:8:>`_

* [2.18.22] - `2022 02 18 LOW TIER GOD YOUTUBE LIVE STREAM kof XV YT GRIND_topics_ then twitch (2_18_2022) :e\ <https://odysee.com/@pneuth:b/-2022-02-18--LOW-TIER-GOD-YOUTUBE-LIVE-STREAM-%F0%9F%9B%91kof-XV-YT-GRIND_topics_-then-twitch-(2_18_2022)--2e5f1c467fd96324aca5cba2011617aa52c0fc9c---4KnEZgPjGoM-:e>`_

* [2.18.22] - `2022 02 18 LOW TIER GOD LIVE STREAM (2 19 2022) (Twitch) (all streams joined) <https://odysee.com/@pneuth:b/-2022-02-18--LOW-TIER-GOD-LIVE-STREAM-(2-19-2022)-(Twitch)-(all-streams-joined)--2159ac2c051df5f234750b9812bd1c56acf1152d-:a>`_

* [2.19.22] - `2022 02 19 LOW TIER GOD YOUTUBE LIVE STREAM kof XV YT 1 hour here_ then twitch (2_19_2022)  f1owYDcJoIQ :a <https://odysee.com/@pneuth:b/-2022-02-19--LOW-TIER-GOD-YOUTUBE-LIVE-STREAM-%F0%9F%9B%91kof-XV-YT-1-hour-here_-then-twitch-(2_19_2022)--1ac40c6cdb031459162d04c58be8b2e268d755e5---f1owYDcJoIQ-:a>`_

* [2.19.22] - `2022 02 19 LOW TIER GOD LIVE STREAM (2 20 2022) (Twitch) (all streams joined) :5 <https://odysee.com/@pneuth:b/-2022-02-19--LOW-TIER-GOD-LIVE-STREAM-(2-20-2022)-(Twitch)-(all-streams-joined)--869aca0b702700dec7d2cd3e19de0563df5e45e2-:5>`_

[2.20.22, 5 parts]

* [https://odysee.com/@pneuth:b/-2022-02-20--LOWTI3RGOD-(live)-2022-02-21-03_30--45605693789-:f] - `2022 02 20 LOWTI3RGOD (live) 2022 02 21 03_30 45605693789 :f <https://odysee.com/@pneuth:b/-2022-02-20--LOWTI3RGOD-(live)-2022-02-21-03_30--45605693789-:f>`_

* [https://odysee.com/@pneuth:b/-2022-02-20--LOWTI3RGOD-(live)-2022-02-21-04_11--45605887949-:3] - `2022 02 20 LOWTI3RGOD (live) 2022 02 21 04_11 45605887949 :3 <https://odysee.com/@pneuth:b/-2022-02-20--LOWTI3RGOD-(live)-2022-02-21-04_11--45605887949-:3>`_

* [https://odysee.com/@pneuth:b/-2022-02-20--LOWTI3RGOD-(live)-2022-02-21-04_44--45606041453-:3] - `2022 02 20 LOWTI3RGOD (live) 2022 02 21 04_44 45606041453 :3 <https://odysee.com/@pneuth:b/-2022-02-20--LOWTI3RGOD-(live)-2022-02-21-04_44--45606041453-:3>`_

* [https://odysee.com/@pneuth:b/-2022-02-20--LOWTI3RGOD-(live)-2022-02-21-04_44--45606041453-:3] - `2022 02 20 LOWTI3RGOD (live) 2022 02 21 04_44 45606041453 :3 <https://odysee.com/@pneuth:b/-2022-02-20--LOWTI3RGOD-(live)-2022-02-21-04_44--45606041453-:3>`_

* [https://odysee.com/@pneuth:b/-2022-02-20--LOWTI3RGOD-(live)-2022-02-20-23_42--45603891005-:4] - `2022 02 20 LOWTI3RGOD (live) 2022 02 20 23_42 45603891005 :4 <https://odysee.com/@pneuth:b/-2022-02-20--LOWTI3RGOD-(live)-2022-02-20-23_42--45603891005-:4>`_

* [2.21.22 incomplete] - `2022 02 21 LOWTI3RGOD (live) 2022 02 22 05_32 45617141965 :1 <https://odysee.com/@pneuth:b/-2022-02-21--LOWTI3RGOD-(live)-2022-02-22-05_32--45617141965-:1>`_

* [V2, more content] - `GNC Stream 2_21_2022 SnzaxWupvJ0  FIXED :4 <https://odysee.com/@Dr.BroadwayMk.III:a/GNC-Stream-2_21_2022--SnzaxWupvJ0---FIXED-:4>`_

* [2.22.22] - `2022 02 22 LOWTI3RGOD (live) 2022 02 23 01_50 45628073117 :0 <https://odysee.com/@pneuth:b/-2022-02-22--LOWTI3RGOD-(live)-2022-02-23-01_50--45628073117-:0>`_

* [2.23.22] - `2022 02 23 LOW TIER GOD YOUTUBE LIVE STREAM %F0%9F%9B%91 reactions 1 hour here_ then twitch (2_23_2022) 73dbeb300d15ac58072f4391763f819edbc32ca0  pldgpSgR1mk :f <https://odysee.com/@pneuth:b/-2022-02-23--LOW-TIER-GOD-YOUTUBE-LIVE-STREAM-%F0%9F%9B%91-reactions-1-hour-here_-then-twitch-(2_23_2022)--73dbeb300d15ac58072f4391763f819edbc32ca0---pldgpSgR1mk-:f>`_

[2.23.22, 2 parts]

* [https://odysee.com/@pneuth:b/-2022-02-23--Lowti3rgod-(Live)-2022-02-24-01-47--45639150525---AUDIO-FIXED-:1] - `2022 02 23 Lowti3rgod (Live) 2022 02 24 01 47 45639150525  AUDIO FIXED :1 <https://odysee.com/@pneuth:b/-2022-02-23--Lowti3rgod-(Live)-2022-02-24-01-47--45639150525---AUDIO-FIXED-:1>`_

* [https://odysee.com/@pneuth:b/-2022-02-23--LOWTI3RGOD-(live)-2022-02-24-05_17--45640146349-:4] - `2022 02 23 LOWTI3RGOD (live) 2022 02 24 05_17 45640146349 :4 <https://odysee.com/@pneuth:b/-2022-02-23--LOWTI3RGOD-(live)-2022-02-24-05_17--45640146349-:4>`_

* [Non-corrupted audio] - `GNC Stream 2_23_2022 N0hL7xii3B0 :6 <https://odysee.com/@Dr.BroadwayMk.III:a/GNC-Stream-2_23_2022--N0hL7xii3B0-:6>`_

[2.25.22]

* [https://odysee.com/@pneuth:b/-2022-02-25--Lowti3rgod-(Live)-2022-02-26-03-24--45663299789---FIXED-AUDIO-:c] - `2022 02 25 Lowti3rgod (Live) 2022 02 26 03 24 45663299789  FIXED AUDIO :c <https://odysee.com/@pneuth:b/-2022-02-25--Lowti3rgod-(Live)-2022-02-26-03-24--45663299789---FIXED-AUDIO-:c>`_

* [https://odysee.com/@pneuth:b/Lowti3rgod-(Live)-2022-02-26-03-24--45663299789-:b] - `Lowti3rgod (Live) 2022 02 26 03 24 45663299789 :b <https://odysee.com/@pneuth:b/Lowti3rgod-(Live)-2022-02-26-03-24--45663299789-:b>`_

* [https://odysee.com/@pneuth:b/LOWTI3RGOD-(live)-2022-02-26-06_43--45664442317-:f] - `LOWTI3RGOD (live) 2022 02 26 06_43 45664442317 :f <https://odysee.com/@pneuth:b/LOWTI3RGOD-(live)-2022-02-26-06_43--45664442317-:f>`_

* [2.26.22] - `2022 02 26 Lowti3rgod (Live) 2022 02 27 01 21 45675056877  FIXED AUDIO :5 <https://odysee.com/@pneuth:b/-2022-02-26--Lowti3rgod-(Live)-2022-02-27-01-21--45675056877---FIXED-AUDIO-:5>`_

* [Non-corrupted audio] - `GNC Stream  2_26_2022 UEWVT8u ycw :e <https://odysee.com/@Dr.BroadwayMk.III:a/GNC-Stream---2_26_2022--UEWVT8u-ycw-:e>`_

* [2.27.22] - `2022 02 27 LOW TIER GOD YOUTUBE LIVE STREAM %F0%9F%9B%91reactions_games_elden ring on twitch (2_27_2022) a766b717c4ac2e5af95efb2f5d75c024c27f29b8  zIoELzmdt4c :9 <https://odysee.com/@pneuth:b/-2022-02-27--LOW-TIER-GOD-YOUTUBE-LIVE-STREAM-%F0%9F%9B%91reactions_games_elden-ring-on-twitch-(2_27_2022)--a766b717c4ac2e5af95efb2f5d75c024c27f29b8---zIoELzmdt4c-:9>`_

* [2.27.22] - `2022 02 27 Lowti3rgod (Live) 2022 02 28 02 08 45686947565  FIXED AUDIO :d <https://odysee.com/@pneuth:b/-2022-02-27--Lowti3rgod-(Live)-2022-02-28-02-08--45686947565---FIXED-AUDIO-:d>`_

* [Non-corrupted audio] - `GNC Stream  2_27_2022 ibdlTubRnhE :b <https://odysee.com/@Dr.BroadwayMk.III:a/GNC-Stream---2_27_2022--ibdlTubRnhE-:b>`_

* [2.28.22] - `2022 02 28 Lowti3rgod (Live) 2022 03 01 01 24 45697476797 FIXED AUDIO :b <https://odysee.com/@pneuth:b/-2022-02-28--Lowti3rgod-(Live)-2022-03-01-01-24-45697476797--FIXED-AUDIO-:b>`_

* [Non-corrupted audio] - `GNC Stream  2_28_2022 kjZnZ6UmeKY  FIXED :9 <https://odysee.com/@Dr.BroadwayMk.III:a/GNC-Stream---2_28_2022--kjZnZ6UmeKY---FIXED-:9>`_

March 2022
-------------

[3.1.22, 5 parts]

* [https://odysee.com/@pneuth:b/-2022-03-01--LOWTI3RGOD-(live)-2022-03-02-02_14--45708498653-:1] - `2022 03 01 LOWTI3RGOD (live) 2022 03 02 02_14 45708498653 :1 <https://odysee.com/@pneuth:b/-2022-03-01--LOWTI3RGOD-(live)-2022-03-02-02_14--45708498653-:1>`_

* [https://odysee.com/@pneuth:b/-2022-03-01--LOWTI3RGOD-(live)-2022-03-02-01_05--45708131261---FIXED-:d] - `2022 03 01 LOWTI3RGOD (live) 2022 03 02 01_05 45708131261  FIXED :d <https://odysee.com/@pneuth:b/-2022-03-01--LOWTI3RGOD-(live)-2022-03-02-01_05--45708131261---FIXED-:d>`_

* [https://odysee.com/@pneuth:b/-2022-03-01--LOWTI3RGOD-(live)-2022-03-02-01_25--45708247197-:b] - `2022 03 01 LOWTI3RGOD (live) 2022 03 02 01_25 45708247197 :b <https://odysee.com/@pneuth:b/-2022-03-01--LOWTI3RGOD-(live)-2022-03-02-01_25--45708247197-:b>`_

* [https://odysee.com/@pneuth:b/-2022-03-01--LOWTI3RGOD-(live)-2022-03-02-02_34--45708594429-:c] - `2022 03 01 LOWTI3RGOD (live) 2022 03 02 02_34 45708594429 :c <https://odysee.com/@pneuth:b/-2022-03-01--LOWTI3RGOD-(live)-2022-03-02-02_34--45708594429-:c>`_

* [https://odysee.com/@pneuth:b/-2022-03-01--LOWTI3RGOD-(live)-2022-03-02-06_13--45709606621-:6] - `2022 03 01 LOWTI3RGOD (live) 2022 03 02 06_13 45709606621 :6 <https://odysee.com/@pneuth:b/-2022-03-01--LOWTI3RGOD-(live)-2022-03-02-06_13--45709606621-:6>`_

* [Non-corrupted audio] - `GNC Stream  3_1_2022 tV91uUpYqms :4 <https://odysee.com/@Dr.BroadwayMk.III:a/GNC-Stream---3_1_2022--tV91uUpYqms-:4>`_

* [3.4.22] - `2022 03 04 LOW TIER GOD YOUTUBE LIVE STREAM %F0%9F%9B%91GAMES_support the yt streams then twitch (3_4_2022) 2022 03 05 00_00 OKoree7cszA:2  <https://odysee.com/@pneuth:b/-2022-03-04--LOW-TIER-GOD-YOUTUBE-LIVE-STREAM-%F0%9F%9B%91GAMES_support-the-yt-streams-then-twitch-(3_4_2022)-2022-03-05-00_00-OKoree7cszA:2->`_

* [3.4.22, 2 parts] - `2022 03 04 LOWTI3RGOD (live) 2022 03 05 03_02 45741512253:c <https://odysee.com/@pneuth:b/-2022-03-04--LOWTI3RGOD-(live)-2022-03-05-03_02-45741512253:c>`_

[3.5.22, 2 parts]

* [https://odysee.com/@pneuth:b/-2022-03-05--Lowti3rgod-(Live)-2022-03-06-02-45-45754079005--FIXED-AUDIO-:c] - `2022 03 05 Lowti3rgod (Live) 2022 03 06 02 45 45754079005 FIXED AUDIO :c <https://odysee.com/@pneuth:b/-2022-03-05--Lowti3rgod-(Live)-2022-03-06-02-45-45754079005--FIXED-AUDIO-:c>`_

* [https://odysee.com/@pneuth:b/-2022-03-05--LOWTI3RGOD-(live)-2022-03-06-05_17-45754927565:f] - `2022 03 05 LOWTI3RGOD (live) 2022 03 06 05_17 45754927565:f <https://odysee.com/@pneuth:b/-2022-03-05--LOWTI3RGOD-(live)-2022-03-06-05_17-45754927565:f>`_

* [Non-corrupted audio] - `GNC Stream  3_5_2022 OspkqsYdFh4 :8 <https://odysee.com/@Dr.BroadwayMk.III:a/GNC-Stream---3_5_2022--OspkqsYdFh4-:8>`_

* [3.6.22] - `2022 03 06 LOW TIER GOD YOUTUBE LIVE STREAM %F0%9F%9B%91GAMES_support the yt streams then twitch (3_6_2022) 2022 03 07 01_22 EeAXoqgEQus:b <https://odysee.com/@pneuth:b/-2022-03-06--LOW-TIER-GOD-YOUTUBE-LIVE-STREAM-%F0%9F%9B%91GAMES_support-the-yt-streams-then-twitch-(3_6_2022)-2022-03-07-01_22-EeAXoqgEQus:b>`_

* [3.6.22] - `2022 03 06 LOWTI3RGOD (live) 2022 03 07 03_23 45765513645:d <https://odysee.com/@pneuth:b/-2022-03-06--LOWTI3RGOD-(live)-2022-03-07-03_23-45765513645:d>`_

[3.7.22]

* [https://odysee.com/@pneuth:b/-2022-03-07--LOWTI3RGOD-(live)-2022-03-08-01_53-45775581853:a] - `2022 03 07 LOWTI3RGOD (live) 2022 03 08 01_53 45775581853:a <https://odysee.com/@pneuth:b/-2022-03-07--LOWTI3RGOD-(live)-2022-03-08-01_53-45775581853:a>`_

* [https://odysee.com/@pneuth:b/-2022-03-07--LOWTI3RGOD-(live)-2022-03-08-02_32-45775771053:3] - `2022 03 07 LOWTI3RGOD (live) 2022 03 08 02_32 45775771053:3 <https://odysee.com/@pneuth:b/-2022-03-07--LOWTI3RGOD-(live)-2022-03-08-02_32-45775771053:3>`_

* [https://odysee.com/@pneuth:b/-2022-03-07--LOWTI3RGOD-(live)-2022-03-08-04_25-45776266637:d] - `2022 03 07 LOWTI3RGOD (live) 2022 03 08 04_25 45776266637:d <https://odysee.com/@pneuth:b/-2022-03-07--LOWTI3RGOD-(live)-2022-03-08-04_25-45776266637:d>`_

* [3.9.22] - `2022 03 09 LOW TIER GOD YOUTUBE LIVE STREAM %F0%9F%9B%91topics_3 hour yt stream then twitch (3_9_2022) 2022 03 10 00_53 nlft9uNiq5w:a <https://odysee.com/@pneuth:b/-2022-03-09--LOW-TIER-GOD-YOUTUBE-LIVE-STREAM-%F0%9F%9B%91topics_3-hour-yt-stream-then-twitch-(3_9_2022)-2022-03-10-00_53-nlft9uNiq5w:a>`_

* [3.9.22] - `2022 03 09 LOW TIER GOD LIVE STREAM (3 10 22) (Twitch) b9ed5cd0f1b3cb396ce38af852daa00e844c1dee :a <https://odysee.com/@pneuth:b/-2022-03-09--LOW-TIER-GOD-LIVE-STREAM-(3-10-22)-(Twitch)--b9ed5cd0f1b3cb396ce38af852daa00e844c1dee-:a>`_

* [V2, more content] - `GNC Stream  3_9_2022 DZngvy0zjtI  FIXED :d <https://odysee.com/@Dr.BroadwayMk.III:a/GNC-Stream---3_9_2022--DZngvy0zjtI---FIXED-:d>`_

* [3.10.22] - `2022 03 10 LOW TIER GOD YOUTUBE LIVE STREAM %F0%9F%9B%91GAMES_ (3_10_2022) 2022 03 10 23_36 I0sdCTZ57sQ:6 <https://odysee.com/@pneuth:b/-2022-03-10--LOW-TIER-GOD-YOUTUBE-LIVE-STREAM-%F0%9F%9B%91GAMES_-(3_10_2022)-2022-03-10-23_36-I0sdCTZ57sQ:6>`_

[3.10.22, 3 parts]

* [https://odysee.com/@pneuth:b/-2022-03-10--LOWTI3RGOD-(live)-2022-03-11-03_25-45807455741:4] - `2022 03 10 LOWTI3RGOD (live) 2022 03 11 03_25 45807455741:4 <https://odysee.com/@pneuth:b/-2022-03-10--LOWTI3RGOD-(live)-2022-03-11-03_25-45807455741:4>`_

* [https://odysee.com/@pneuth:b/-2022-03-10--LOWTI3RGOD-(live)-2022-03-11-03_55-45807785549:6] - `2022 03 10 LOWTI3RGOD (live) 2022 03 11 03_55 45807785549:6 <https://odysee.com/@pneuth:b/-2022-03-10--LOWTI3RGOD-(live)-2022-03-11-03_55-45807785549:6>`_

* [https://odysee.com/@pneuth:b/-2022-03-10--LOWTI3RGOD-(live)-2022-03-11-04_07-45807843757:3] - `2022 03 10 LOWTI3RGOD (live) 2022 03 11 04_07 45807843757:3 <https://odysee.com/@pneuth:b/-2022-03-10--LOWTI3RGOD-(live)-2022-03-11-04_07-45807843757:3>`_

* [3.11.22] - `2022 03 11 LOW TIER GOD YOUTUBE LIVE STREAM %F0%9F%9B%91GAMES_SHORT_TWITCH (3_11_2022) 2022 03 12 00_24 rO67LRXXV98:4 <https://odysee.com/@pneuth:b/-2022-03-11--LOW-TIER-GOD-YOUTUBE-LIVE-STREAM-%F0%9F%9B%91GAMES_SHORT_TWITCH-(3_11_2022)-2022-03-12-00_24-rO67LRXXV98:4>`_

* [3.11.22, 2 parts] - `2022 03 11 LOWTI3RGOD (live) 2022 03 12 03_50 45819460765:3 <https://odysee.com/@pneuth:b/-2022-03-11--LOWTI3RGOD-(live)-2022-03-12-03_50-45819460765:3>`_

* [https://odysee.com/@pneuth:b/-2022-03-11--LOWTI3RGOD-(live)-2022-03-12-04_38-45819822061:d] - `2022 03 11 LOWTI3RGOD (live) 2022 03 12 04_38 45819822061:d <https://odysee.com/@pneuth:b/-2022-03-11--LOWTI3RGOD-(live)-2022-03-12-04_38-45819822061:d>`_

* [3.12.22] - `2022 03 12 LOW TIER GOD YOUTUBE LIVE STREAM %F0%9F%9B%91GAMES_TOPICS (3_12_2022) 2022 03 13 00_59 iZ6gmXjLJ3Q:f <https://odysee.com/@pneuth:b/-2022-03-12--LOW-TIER-GOD-YOUTUBE-LIVE-STREAM-%F0%9F%9B%91GAMES_TOPICS-(3_12_2022)-2022-03-13-00_59-iZ6gmXjLJ3Q:f>`_

* [3.12.22] - `2022 03 12 LOW TIER GOD LIVE STREAM (3 13 22) (Twitch) 24957294fb10096fa8013c51655c3faf3b768767 :a <https://odysee.com/@pneuth:b/-2022-03-12--LOW-TIER-GOD-LIVE-STREAM-(3-13-22)-(Twitch)--24957294fb10096fa8013c51655c3faf3b768767-:a>`_

* [3.13.22] - `2022 03 13 LOW TIER GOD YOUTUBE LIVE STREAM %F0%9F%9B%91GAMES_TOPICS (3_13_2022) 2022 03 14 00_46 30 1kY9eC6k:6 <https://odysee.com/@pneuth:b/-2022-03-13--LOW-TIER-GOD-YOUTUBE-LIVE-STREAM-%F0%9F%9B%91GAMES_TOPICS-(3_13_2022)-2022-03-14-00_46-30-1kY9eC6k:6>`_

* [3.13.22] - `2022 03 13 LOWTI3RGOD (live) 2022 03 14 03_24 45842770589:d <https://odysee.com/@pneuth:b/-2022-03-13--LOWTI3RGOD-(live)-2022-03-14-03_24-45842770589:d>`_

* [3.14.22] - `2022 03 14 LOW TIER GOD YOUTUBE LIVE STREAM %F0%9F%9B%91GAMES_TOPICS (3_14_2022) 2022 03 15 00_30 Z Yq0 GnQpI:6 <https://odysee.com/@pneuth:b/-2022-03-14--LOW-TIER-GOD-YOUTUBE-LIVE-STREAM-%F0%9F%9B%91GAMES_TOPICS-(3_14_2022)-2022-03-15-00_30-Z-Yq0-GnQpI:6>`_

* [3.14.22] - `2022 03 14 LOWTI3RGOD (live) 2022 03 15 03_19 45853345917:4 <https://odysee.com/@pneuth:b/-2022-03-14--LOWTI3RGOD-(live)-2022-03-15-03_19-45853345917:4>`_

* [3.15.22] - `2022 03 15 LOW TIER GOD LIVE STREAM (3 16 22) (Twitch) (corrupt fix_audio recovered) 11679319a29ee831128600afe26fd517dbd7c8b9 :0 <https://odysee.com/@pneuth:b/-2022-03-15--LOW-TIER-GOD-LIVE-STREAM-(3-16-22)-(Twitch)-(corrupt-fix_audio-recovered)--11679319a29ee831128600afe26fd517dbd7c8b9-:0>`_

* [3.16.22] - `2022 03 16 LOWTI3RGOD (live) 2022 03 17 00_37 45873783613:d <https://odysee.com/@pneuth:b/-2022-03-16--LOWTI3RGOD-(live)-2022-03-17-00_37-45873783613:d>`_

[3.17.22]

* [https://odysee.com/@pneuth:b/-2022-03-17--Lowti3rgod-(Live)-2022-03-18-01-10-45884443997--FIXED-AUDIO-:1] - `2022 03 17 Lowti3rgod (Live) 2022 03 18 01 10 45884443997 FIXED AUDIO :1 <https://odysee.com/@pneuth:b/-2022-03-17--Lowti3rgod-(Live)-2022-03-18-01-10-45884443997--FIXED-AUDIO-:1>`_

* [https://odysee.com/@pneuth:b/-2022-03-17--LOWTI3RGOD-(live)-2022-03-18-05_23-45885648781:f] - `2022 03 17 LOWTI3RGOD (live) 2022 03 18 05_23 45885648781:f <https://odysee.com/@pneuth:b/-2022-03-17--LOWTI3RGOD-(live)-2022-03-18-05_23-45885648781:f>`_

* [https://odysee.com/@pneuth:b/-2022-03-17--LOWTI3RGOD-(live)-2022-03-18-03_28-45885158125:8] - `2022 03 17 LOWTI3RGOD (live) 2022 03 18 03_28 45885158125:8 <https://odysee.com/@pneuth:b/-2022-03-17--LOWTI3RGOD-(live)-2022-03-18-03_28-45885158125:8>`_

* [https://odysee.com/@pneuth:b/-2022-03-17--LOWTI3RGOD-(live)-2022-03-18-03_45-45885227133:4] - `2022 03 17 LOWTI3RGOD (live) 2022 03 18 03_45 45885227133:4 <https://odysee.com/@pneuth:b/-2022-03-17--LOWTI3RGOD-(live)-2022-03-18-03_45-45885227133:4>`_

* [Non-corrupted audio] - `GNC Stream  3_17_2022 eQuI8oWGSQQ :7 <https://odysee.com/@Dr.BroadwayMk.III:a/GNC-Stream---3_17_2022--eQuI8oWGSQQ-:7>`_

* [3.18.22] - `2022 03 18 LOW TIER GOD YOUTUBE LIVE STREAM %F0%9F%9B%91GAMES_TOPICS (3_18_2022) 2022 03 19 00_34 4sM4auuD1HE:2 <https://odysee.com/@pneuth:b/-2022-03-18--LOW-TIER-GOD-YOUTUBE-LIVE-STREAM-%F0%9F%9B%91GAMES_TOPICS-(3_18_2022)-2022-03-19-00_34-4sM4auuD1HE:2>`_

* [3.18.22] - `2022 03 18 LOWTI3RGOD (live) 2022 03 19 05_17 45896998413 2 :a <https://odysee.com/@pneuth:b/-2022-03-18--LOWTI3RGOD-(live)-2022-03-19-05_17-45896998413--2-:a>`_

[3.19.22]

* [https://odysee.com/@pneuth:b/-2022-03-19--LOWTI3RGOD-(live)-2022-03-20-02_01-45907931917:6] - `2022 03 19 LOWTI3RGOD (live) 2022 03 20 02_01 45907931917:6 <https://odysee.com/@pneuth:b/-2022-03-19--LOWTI3RGOD-(live)-2022-03-20-02_01-45907931917:6>`_

* [Non-corrupted audio] - `GNC Stream  3_19_2022 DCbBC9Yse Y :9 <https://odysee.com/@Dr.BroadwayMk.III:a/GNC-Stream---3_19_2022--DCbBC9Yse-Y-:9>`_

* [3.22.22, 2 parts] - `2022 03 22 LOWTI3RGOD (live) 2022 03 23 04_11 45940924445:c <https://odysee.com/@pneuth:b/-2022-03-22--LOWTI3RGOD-(live)-2022-03-23-04_11-45940924445:c>`_

* [Non-corrupted audio] - `GNC Stream  3_22_2022 AcLxfE9mPbw  FIXED :1 <https://odysee.com/@Dr.BroadwayMk.III:a/GNC-Stream---3_22_2022--AcLxfE9mPbw---FIXED-:1>`_

* [3.23.22] - `LOWTI3RGOD (live) 2022 03 24 00_23 45950240141:3 <https://odysee.com/@pneuth:b/LOWTI3RGOD-(live)-2022-03-24-00_23-45950240141:3>`_

* [Non-corrupted audio] - `GNC Stream  3_23_2022 xI9dMJH7PVo :d <https://odysee.com/@Dr.BroadwayMk.III:a/GNC-Stream---3_23_2022--xI9dMJH7PVo-:d>`_

* [3.24.22] - `2022 03 24 Lowti3rgod (Live) 2022 03 25 00 49 45960615293 FIXED AUDIO :f <https://odysee.com/@pneuth:b/-2022-03-24--Lowti3rgod-(Live)-2022-03-25-00-49-45960615293--FIXED-AUDIO-:f>`_

* [Non-corrupted audio] - `GNC Stream  3_24_2022 veucsv_ORfk :2 <https://odysee.com/@Dr.BroadwayMk.III:a/GNC-Stream---3_24_2022--veucsv_ORfk-:2>`_

[3.25.22, 2 parts]

* [https://odysee.com/@pneuth:b/-2022-03-25--LOWTI3RGOD-(live)-2022-03-26-03_00-45972435469:6] - `2022 03 25 LOWTI3RGOD (live) 2022 03 26 03_00 45972435469:6 <https://odysee.com/@pneuth:b/-2022-03-25--LOWTI3RGOD-(live)-2022-03-26-03_00-45972435469:6>`_

* [https://odysee.com/@pneuth:b/-2022-03-25--Lowti3rgod-(Live)-2022-03-25-23-31-45970861149--FIXED-AUDIO-:4] - `2022 03 25 Lowti3rgod (Live) 2022 03 25 23 31 45970861149 FIXED AUDIO :4 <https://odysee.com/@pneuth:b/-2022-03-25--Lowti3rgod-(Live)-2022-03-25-23-31-45970861149--FIXED-AUDIO-:4>`_

* [Non-corrupted audio MASSIVE 7HR STREAM] - `GNC Stream  3_25_2022 vltSpNgL8JM :1 <https://odysee.com/@Dr.BroadwayMk.III:a/GNC-Stream---3_25_2022--vltSpNgL8JM-:1>`_

* [3.26.22] - `2022 03 26 LOW TIER GOD YOUTUBE LIVE STREAM %F0%9F%9B%91LETS CHILL WATCH VIDS AND GAME (3_26_2022) 2022 03 27 00_01 KX5UOlu88b8:7 <https://odysee.com/@pneuth:b/-2022-03-26--LOW-TIER-GOD-YOUTUBE-LIVE-STREAM-%F0%9F%9B%91LETS-CHILL-WATCH-VIDS-AND-GAME--(3_26_2022)-2022-03-27-00_01-KX5UOlu88b8:7>`_

* [3.27.22] - `2022 03 27 LOW TIER GOD YOUTUBE LIVE STREAM %F0%9F%9B%91WILL SLAPS CHRIS ROCK REACTION_SFV PATCH NOTES (3_26_2022) 2022 03 28 01_38 k04MAzrU 0I:1 <https://odysee.com/@pneuth:b/-2022-03-27--LOW-TIER-GOD-YOUTUBE-LIVE-STREAM-%F0%9F%9B%91WILL-SLAPS-CHRIS-ROCK-REACTION_SFV-PATCH-NOTES--(3_26_2022)-2022-03-28-01_38-k04MAzrU-0I:1>`_

[3.29.22, 2 parts]

* [https://odysee.com/@pneuth:b/-2022-03-29--LOWTI3RGOD-(live)-2022-03-29-23_58-46013757469:e] - `2022 03 29 LOWTI3RGOD (live) 2022 03 29 23_58 46013757469:e <https://odysee.com/@pneuth:b/-2022-03-29--LOWTI3RGOD-(live)-2022-03-29-23_58-46013757469:e>`_

* [https://odysee.com/@pneuth:b/-2022-03-29--Lowti3rgod-(Live)-2022-03-29-23-51-46013698829--FIXED-AUDIO-:8] - `2022 03 29 Lowti3rgod (Live) 2022 03 29 23 51 46013698829 FIXED AUDIO :8 <https://odysee.com/@pneuth:b/-2022-03-29--Lowti3rgod-(Live)-2022-03-29-23-51-46013698829--FIXED-AUDIO-:8>`_

* [Non-corrupted audio] - `GNC Stream  3_29_2022 rR9CJtE8jLs :4 <https://odysee.com/@Dr.BroadwayMk.III:a/GNC-Stream---3_29_2022--rR9CJtE8jLs-:4>`_

* [3.30.22] - `2022 03 30 LOW TIER GOD YOUTUBE LIVE STREAM %F0%9F%9B%91 REACTIONS_SMASH_SFV_ETV (3_30_2022) 2022 03 31 00_13 VFay777_pPs:5 <https://odysee.com/@pneuth:b/-2022-03-30--LOW-TIER-GOD-YOUTUBE-LIVE-STREAM-%F0%9F%9B%91-REACTIONS_SMASH_SFV_ETV-(3_30_2022)-2022-03-31-00_13-VFay777_pPs:5>`_

[3.31.22, 2 parts]

* [https://odysee.com/@pneuth:b/-2022-03-31--Lowti3rgod-(Live)-2022-04-01-01-11-46034517165--FIXED-AUDIO-but-720p-:4] - `2022 03 31 Lowti3rgod (Live) 2022 04 01 01 11 46034517165 FIXED AUDIO but 720p :4 <https://odysee.com/@pneuth:b/-2022-03-31--Lowti3rgod-(Live)-2022-04-01-01-11-46034517165--FIXED-AUDIO-but-720p-:4>`_

* [https://odysee.com/@pneuth:b/-2022-03-31--LOWTI3RGOD-(live)-2022-04-01-05_57-46035707837:c] - `2022 03 31 LOWTI3RGOD (live) 2022 04 01 05_57 46035707837:c <https://odysee.com/@pneuth:b/-2022-03-31--LOWTI3RGOD-(live)-2022-04-01-05_57-46035707837:c>`_

* [Non-corrupted audio] - `GNC Stream  3_31_2022 DAzhBFxKxLY :d <https://odysee.com/@Dr.BroadwayMk.III:a/GNC-Stream---3_31_2022--DAzhBFxKxLY-:d>`_

April 2022
-------------

* [4.1.22] - `2022 04 01 LOW TIER GOD YOUTUBE LIVE STREAM %F0%9F%9B%91Chillen for an hour then dfn duel_twitch (4_1_2022) 2022 04 02 01_22 nduRKW0UkBw:e <https://odysee.com/@pneuth:b/-2022-04-01--LOW-TIER-GOD-YOUTUBE-LIVE-STREAM-%F0%9F%9B%91Chillen-for-an-hour-then-dfn-duel_twitch--(4_1_2022)-2022-04-02-01_22-nduRKW0UkBw:e>`_

* [4.1.22] - `2022 04 01 LOWTI3RGOD (live) 2022 04 02 04_09 46046256845 FIXED :e <https://odysee.com/@pneuth:b/-2022-04-01--LOWTI3RGOD-(live)-2022-04-02-04_09-46046256845--FIXED-:e>`_

* [Non-corrupted audio] - `GNC Stream  4_1_2022 n3mlcFnh7Kc :f <https://odysee.com/@Dr.BroadwayMk.III:a/GNC-Stream---4_1_2022--n3mlcFnh7Kc-:f>`_

* [4.2.22] - `2022 04 02 Lowti3rgod (Live) 2022 04 03 00 29 46056268941 SALVAGED AUDIO :4 <https://odysee.com/@pneuth:b/-2022-04-02--Lowti3rgod-(Live)-2022-04-03-00-29-46056268941--SALVAGED-AUDIO-:4>`_

* [Non-corrupted audio] - `GNC Stream  4_2_2022 1VTg4k3rf9w :2 <https://odysee.com/@Dr.BroadwayMk.III:a/GNC-Stream---4_2_2022--1VTg4k3rf9w-:2>`_

* [4.3.22] - `2022 04 03 LOW TIER GOD YOUTUBE LIVE STREAM %F0%9F%9B%91Chillen_Games then_twitch (4_3_2022) 2022 04 04 00_57 U6Lj3GTeOPY:f <https://odysee.com/@pneuth:b/-2022-04-03--LOW-TIER-GOD-YOUTUBE-LIVE-STREAM-%F0%9F%9B%91Chillen_Games-then_twitch--(4_3_2022)-2022-04-04-00_57-U6Lj3GTeOPY:f>`_

* [V2, more content] - `GNC Stream  4_3_2022 d9B4r2ZXFow  FIXED :3 <https://odysee.com/@Dr.BroadwayMk.III:a/GNC-Stream---4_3_2022--d9B4r2ZXFow---FIXED-:3>`_

* [4.3.22] - `2022 04 03 LOWTI3RGOD (live) 2022 04 04 03_19 46067746637:a <https://odysee.com/@pneuth:b/-2022-04-03--LOWTI3RGOD-(live)-2022-04-04-03_19-46067746637:a>`_

* [4.4.22] - `GNC Stream  4_4_2022 3qmDBx7P1jw  FIXED :5 <https://odysee.com/@Dr.BroadwayMk.III:a/GNC-Stream---4_4_2022--3qmDBx7P1jw---FIXED-:5>`_

* [4.6.22] - `2022 04 06 LOW TIER GOD YOUTUBE LIVE STREAM %F0%9F%9B%91Chillen_Games then_twitch (4_6_2022) 2022 04 07 00_02 lY62WvG7wqA:7 <https://odysee.com/@pneuth:b/-2022-04-06--LOW-TIER-GOD-YOUTUBE-LIVE-STREAM-%F0%9F%9B%91Chillen_Games-then_twitch--(4_6_2022)-2022-04-07-00_02-lY62WvG7wqA:7>`_

* [4.7.22] - `2022 04 07 LOW TIER GOD YOUTUBE LIVE STREAM %F0%9F%9B%91_RE5_SPEED TOPIC_CRAZY BECKY TOPIC_then_twitch (4_7_2022) 2022 04 07 23_10 aZFK6oHwcDw:7 <https://odysee.com/@pneuth:b/-2022-04-07--LOW-TIER-GOD-YOUTUBE-LIVE-STREAM-%F0%9F%9B%91_RE5_SPEED-TOPIC_CRAZY-BECKY-TOPIC_then_twitch-(4_7_2022)-2022-04-07-23_10-aZFK6oHwcDw:7>`_

* [4.7.22] - `2022 04 07 LOWTI3RGOD (live) 2022 04 08 02_34 46106526685:8 <https://odysee.com/@pneuth:b/-2022-04-07--LOWTI3RGOD-(live)-2022-04-08-02_34-46106526685:8>`_

* [4.8.22, hate speech?] - `2022 04 08 LOW TIER GOD YOUTUBE LIVE STREAM %F0%9F%9B%91_jada pinket breakdown TOPICthen_twitch (4_8_2022) 2022 04 09 00_15 ISmDqFNY4zI:6 <https://odysee.com/@pneuth:b/-2022-04-08--LOW-TIER-GOD-YOUTUBE-LIVE-STREAM-%F0%9F%9B%91_jada-pinket-breakdown-TOPICthen_twitch-(4_8_2022)-2022-04-09-00_15-ISmDqFNY4zI:6>`_

* [4.8.22] - `2022 04 08 LOWTI3RGOD (live) 2022 04 09 01_54 46116678893 FIXED AUDIO :7 <https://odysee.com/@pneuth:b/-2022-04-08--LOWTI3RGOD-(live)-2022-04-09-01_54-46116678893--FIXED-AUDIO-:7>`_

* [Non-corrupted audio] - `GNC Stream  4_8_2022 0AjF80zB2KI :9 <https://odysee.com/@Dr.BroadwayMk.III:a/GNC-Stream---4_8_2022--0AjF80zB2KI-:9>`_

* [4.9.22, 2 parts] - `2022 04 09 LOWTI3RGOD (live) 2022 04 10 02_39 46127831597 FIXED AUDIO :1 <https://odysee.com/@pneuth:b/-2022-04-09--LOWTI3RGOD-(live)-2022-04-10-02_39-46127831597--FIXED-AUDIO-:1>`_

* [https://odysee.com/@pneuth:b/-2022-04-09--LOWTI3RGOD-(live)-2022-04-10-04_12-39645901497:6] - `2022 04 09 LOWTI3RGOD (live) 2022 04 10 04_12 39645901497:6 <https://odysee.com/@pneuth:b/-2022-04-09--LOWTI3RGOD-(live)-2022-04-10-04_12-39645901497:6>`_

* [Non-corrupted audio] - `GNC Stream  4_9_2022 krZp8OM55Xw :f <https://odysee.com/@Dr.BroadwayMk.III:a/GNC-Stream---4_9_2022--krZp8OM55Xw-:f>`_

[4.11.22, 2 parts]

* [https://odysee.com/@pneuth:b/-2022-04-11--LOWTI3RGOD-(live)-2022-04-12-02_38-46147669821--FIXED-AUDIO-:c] - `2022 04 11 LOWTI3RGOD (live) 2022 04 12 02_38 46147669821 FIXED AUDIO :c <https://odysee.com/@pneuth:b/-2022-04-11--LOWTI3RGOD-(live)-2022-04-12-02_38-46147669821--FIXED-AUDIO-:c>`_

* [https://odysee.com/@pneuth:b/-2022-04-11--LOWTI3RGOD-(live)-2022-04-12-04_05-46147955053:8] - `2022 04 11 LOWTI3RGOD (live) 2022 04 12 04_05 46147955053:8 <https://odysee.com/@pneuth:b/-2022-04-11--LOWTI3RGOD-(live)-2022-04-12-04_05-46147955053:8>`_

[4.12.22, 3 parts]

* [https://odysee.com/@pneuth:b/-2022-04-12--LOWTI3RGOD-(live)-2022-04-13--46156903085-:6] - `2022 04 12 LOWTI3RGOD (live) 2022 04 13 46156903085 :6 <https://odysee.com/@pneuth:b/-2022-04-12--LOWTI3RGOD-(live)-2022-04-13--46156903085-:6>`_

* [https://odysee.com/@pneuth:b/-2022-04-12--LOWTI3RGOD-(live)-2022-04-13--46156824093-:5] - `2022 04 12 LOWTI3RGOD (live) 2022 04 13 46156824093 :5 <https://odysee.com/@pneuth:b/-2022-04-12--LOWTI3RGOD-(live)-2022-04-13--46156824093-:5>`_

* [https://odysee.com/@pneuth:b/-2022-04-12--LOWTI3RGOD-(live)-2022-04-13--46157549965-:f] - `2022 04 12 LOWTI3RGOD (live) 2022 04 13 46157549965 :f <https://odysee.com/@pneuth:b/-2022-04-12--LOWTI3RGOD-(live)-2022-04-13--46157549965-:f>`_

* [Non-corrupted audio] - `GNC Stream  4_12_2022 TwCcUJem7Yw :2 <https://odysee.com/@Dr.BroadwayMk.III:a/GNC-Stream---4_12_2022--TwCcUJem7Yw-:2>`_

* [4.14.22] - `2022 04 14 LOWTI3RGOD (live) 2022 04 15 00_09 46174960493 BROKEN AUDIO :b <https://odysee.com/@pneuth:b/-2022-04-14--LOWTI3RGOD-(live)-2022-04-15-00_09-46174960493--BROKEN-AUDIO-:b>`_

* [Non-corrupted audio] - `GNC Stream  4_14_2022 4nut3gYDQwk :6 <https://odysee.com/@Dr.BroadwayMk.III:a/GNC-Stream---4_14_2022--4nut3gYDQwk-:6>`_

* [4.15.22] - `2022 04 15 LOW TIER GOD YOUTUBE LIVE STREAM %F0%9F%9B%91GAMES_TOPICS (4_15_2022) 8ff492095ba1e10ba6cffd347fbfca1881dfe055 :b <https://odysee.com/@pneuth:b/-2022-04-15--LOW-TIER-GOD-YOUTUBE-LIVE-STREAM-%F0%9F%9B%91GAMES_TOPICS-(4_15_2022)--8ff492095ba1e10ba6cffd347fbfca1881dfe055-:b>`_

* [4.16.22] - `2022 04 16 LOW TIER GOD YOUTUBE LIVE STREAM %F0%9F%9B%91GAMES_sf_rust etc (4_16_2022) 2022 04 17 02_24 o1cfss DNmQ:e <https://odysee.com/@pneuth:b/-2022-04-16--LOW-TIER-GOD-YOUTUBE-LIVE-STREAM-%F0%9F%9B%91GAMES_sf_rust-etc-(4_16_2022)-2022-04-17-02_24-o1cfss-DNmQ:e>`_

* [4.17.22] - `2022 04 17 LOWTI3RGOD (live) 2022 04 18:0 <https://odysee.com/@pneuth:b/-2022-04-17--LOWTI3RGOD-(live)-2022-04-18:0>`_

* [4.18.22] - `2022 04 18 LOW TIER GOD YOUTUBE LIVE STREAM %F0%9F%9B%91GAMES_SMASH (4_18_2022) 2022 04 19 00_43 FeXrGDDbZNg:d <https://odysee.com/@pneuth:b/-2022-04-18--LOW-TIER-GOD-YOUTUBE-LIVE-STREAM-%F0%9F%9B%91GAMES_SMASH-(4_18_2022)-2022-04-19-00_43-FeXrGDDbZNg:d>`_

[4.18.22, 3 parts]

* [https://odysee.com/@pneuth:b/-2022-04-18--LOWTI3RGOD-(live)-2022-04-19-02_12-46211667389:b] - `2022 04 18 LOWTI3RGOD (live) 2022 04 19 02_12 46211667389:b <https://odysee.com/@pneuth:b/-2022-04-18--LOWTI3RGOD-(live)-2022-04-19-02_12-46211667389:b>`_

* [https://odysee.com/@pneuth:b/-2022-04-18--LOWTI3RGOD-(live)-2022-04-19-03_28-46211927853:d] - `2022 04 18 LOWTI3RGOD (live) 2022 04 19 03_28 46211927853:d <https://odysee.com/@pneuth:b/-2022-04-18--LOWTI3RGOD-(live)-2022-04-19-03_28-46211927853:d>`_

* [https://odysee.com/@pneuth:b/-2022-04-18--LOWTI3RGOD-(live)-2022-04-19-05_13-46212222381:3] - `2022 04 18 LOWTI3RGOD (live) 2022 04 19 05_13 46212222381:3 <https://odysee.com/@pneuth:b/-2022-04-18--LOWTI3RGOD-(live)-2022-04-19-05_13-46212222381:3>`_

* [4.19.22] - `2022 04 19 LOW TIER GOD YOUTUBE LIVE STREAM %F0%9F%9B%91_TOPICs_SFV RANKED (4_19_2022) 2022 04 20 00_24 JNZorwap7Vw:d <https://odysee.com/@pneuth:b/-2022-04-19--LOW-TIER-GOD-YOUTUBE-LIVE-STREAM-%F0%9F%9B%91_TOPICs_SFV-RANKED-(4_19_2022)-2022-04-20-00_24-JNZorwap7Vw:d>`_

[4.19.22, 2 parts]

* [https://odysee.com/@pneuth:b/-2022-04-19--LOWTI3RGOD-(live)-2022-04-20-01_46-46220013581:9] - `2022 04 19 LOWTI3RGOD (live) 2022 04 20 01_46 46220013581:9 <https://odysee.com/@pneuth:b/-2022-04-19--LOWTI3RGOD-(live)-2022-04-20-01_46-46220013581:9>`_

* [https://odysee.com/@pneuth:b/-2022-04-19--LOWTI3RGOD-(live)-2022-04-20-03_06-46220306509:2] - `2022 04 19 LOWTI3RGOD (live) 2022 04 20 03_06 46220306509:2 <https://odysee.com/@pneuth:b/-2022-04-19--LOWTI3RGOD-(live)-2022-04-20-03_06-46220306509:2>`_

* [4.21.22] - `2022 04 21 LOW TIER GOD YOUTUBE LIVE STREAM %F0%9F%9B%91_LETS GAME, YOUTUBE THEN TWITCH (4_21_2022) 2022 04 21 23_19 iuestarizRA:c <https://odysee.com/@pneuth:b/-2022-04-21--LOW-TIER-GOD-YOUTUBE-LIVE-STREAM-%F0%9F%9B%91_LETS-GAME,-YOUTUBE-THEN-TWITCH-(4_21_2022)-2022-04-21-23_19-iuestarizRA:c>`_

[4.21.22, 2 parts]

* [https://odysee.com/@pneuth:b/-2022-04-21--LOWTI3RGOD-(live)-2022-04-22-02_37-39676133609--fe8053a33ec24357187fca53f810a8399d4759d9-:9] - `2022 04 21 LOWTI3RGOD (live) 2022 04 22 02_37 39676133609 fe8053a33ec24357187fca53f810a8399d4759d9 :9 <https://odysee.com/@pneuth:b/-2022-04-21--LOWTI3RGOD-(live)-2022-04-22-02_37-39676133609--fe8053a33ec24357187fca53f810a8399d4759d9-:9>`_

* [https://odysee.com/@pneuth:b/-2022-04-21--LOWTI3RGOD-(live)-2022-04-22-01_56-39676090105:a] - `2022 04 21 LOWTI3RGOD (live) 2022 04 22 01_56 39676090105:a <https://odysee.com/@pneuth:b/-2022-04-21--LOWTI3RGOD-(live)-2022-04-22-01_56-39676090105:a>`_

* [4.22.22] - `2022 04 22 LOW TIER GOD YOUTUBE LIVE STREAM %F0%9F%9B%91_LETS GAME (4_22_2022) 2022 04 22 23_41 N6pUm4fP_fo:3 <https://odysee.com/@pneuth:b/-2022-04-22--LOW-TIER-GOD-YOUTUBE-LIVE-STREAM-%F0%9F%9B%91_LETS-GAME-(4_22_2022)-2022-04-22-23_41-N6pUm4fP_fo:3>`_

* [4.22.22] - `2022 04 22 LOWTI3RGOD (live) 2022 04 23 01_39 39678340601:c <https://odysee.com/@pneuth:b/-2022-04-22--LOWTI3RGOD-(live)-2022-04-23-01_39-39678340601:c>`_

* [4.23.22] - `2022 04 23 LOWTI3RGOD (live) 2022 04 24 01_44 39680766217:6 <https://odysee.com/@pneuth:b/-2022-04-23--LOWTI3RGOD-(live)-2022-04-24-01_44-39680766217:6>`_

* [4.26.22] - `2022 04 26 LOW TIER GOD YOUTUBE LIVE STREAM %F0%9F%9B%91GAMES_mem tees dropped (4_26_2022) GShhFp7gG5E e8731e381dcc32f79a84ba7f22dcdd9ea035ba64 :2 <https://odysee.com/@pneuth:b/-2022-04-26--LOW-TIER-GOD-YOUTUBE-LIVE-STREAM-%F0%9F%9B%91GAMES_mem-tees-dropped-(4_26_2022)--GShhFp7gG5E--e8731e381dcc32f79a84ba7f22dcdd9ea035ba64-:2>`_

* [4.26.22] - `2022 04 26 LOWTI3RGOD (live) 2022 04 27 04_12 46281282621:2 <https://odysee.com/@pneuth:b/-2022-04-26--LOWTI3RGOD-(live)-2022-04-27-04_12-46281282621:2>`_

* [4.27.22] - `2022 04 27 LOW TIER GOD YOUTUBE LIVE STREAM %F0%9F%9B%91GAMES_mem tees dropped (4_27_2022) 2022 04 27 23_45 4B0LOeh0wfQ:a <https://odysee.com/@pneuth:b/-2022-04-27--LOW-TIER-GOD-YOUTUBE-LIVE-STREAM-%F0%9F%9B%91GAMES_mem-tees-dropped-(4_27_2022)-2022-04-27-23_45-4B0LOeh0wfQ:a>`_

[4.27.22, 2 parts]

* [https://odysee.com/@pneuth:b/-2022-04-27--LOWTI3RGOD-(live)-2022-04-28-02_14-39689498521:e] - `2022 04 27 LOWTI3RGOD (live) 2022 04 28 02_14 39689498521:e <https://odysee.com/@pneuth:b/-2022-04-27--LOWTI3RGOD-(live)-2022-04-28-02_14-39689498521:e>`_

* [https://odysee.com/@pneuth:b/-2022-04-27--LOWTI3RGOD-(live)-2022-04-28-04_45-39689624825:3] - `2022 04 27 LOWTI3RGOD (live) 2022 04 28 04_45 39689624825:3 <https://odysee.com/@pneuth:b/-2022-04-27--LOWTI3RGOD-(live)-2022-04-28-04_45-39689624825:3>`_

[4.28.22, 2 parts]

* [https://odysee.com/@pneuth:b/-2022-04-28--LOWTI3RGOD-(live)-2022-04-29-00_36-46295838317:f] - `2022 04 28 LOWTI3RGOD (live) 2022 04 29 00_36 46295838317:f <https://odysee.com/@pneuth:b/-2022-04-28--LOWTI3RGOD-(live)-2022-04-29-00_36-46295838317:f>`_

* [https://odysee.com/@pneuth:b/-2022-04-28--LOWTI3RGOD-(live)-2022-04-29-05_57-46296635533--34274e78e147dc6d58a600887fc0e8f6b4b663c8-:6] - `2022 04 28 LOWTI3RGOD (live) 2022 04 29 05_57 46296635533 34274e78e147dc6d58a600887fc0e8f6b4b663c8 :6 <https://odysee.com/@pneuth:b/-2022-04-28--LOWTI3RGOD-(live)-2022-04-29-05_57-46296635533--34274e78e147dc6d58a600887fc0e8f6b4b663c8-:6>`_

* [4.29.22] - `2022 04 29 LOWTI3RGOD (live) 2022 04 30 02_15 46303426141:4 <https://odysee.com/@pneuth:b/-2022-04-29--LOWTI3RGOD-(live)-2022-04-30-02_15-46303426141:4>`_

* [4.30.22] - `2022 04 30 LOW TIER GOD YOUTUBE LIVE STREAM %F0%9F%9B%91GAMES_mem tees dropped (4_30_2022) 2022 05 01 02_17 YwYqTpOWeVQ:e <https://odysee.com/@pneuth:b/-2022-04-30--LOW-TIER-GOD-YOUTUBE-LIVE-STREAM-%F0%9F%9B%91GAMES_mem-tees-dropped-(4_30_2022)-2022-05-01-02_17-YwYqTpOWeVQ:e>`_

May 2022
-------------

* [5.1.22] - `2022 05 01 LOWTI3RGOD (live) 2022 05 02 01_49 46319138413:c <https://odysee.com/@pneuth:b/-2022-05-01--LOWTI3RGOD-(live)-2022-05-02-01_49-46319138413:c>`_

* [5.2.22] - `2022 05 02 LOWTI3RGOD (live) 2022 05 03 01_57 46325774973:c <https://odysee.com/@pneuth:b/-2022-05-02--LOWTI3RGOD-(live)-2022-05-03-01_57-46325774973:c>`_

* [5.3.22] - `2022 05 03 LOW TIER GOD YOUTUBE LIVE STREAM %F0%9F%9B%91_LETS GAME (5_3_2022) 2022 05 04 00_41 RF3i6xI81z8:f <https://odysee.com/@pneuth:b/-2022-05-03--LOW-TIER-GOD-YOUTUBE-LIVE-STREAM-%F0%9F%9B%91_LETS-GAME-(5_3_2022)-2022-05-04-00_41-RF3i6xI81z8:f>`_

* [5.3.22] - `2022 05 03 LOWTI3RGOD (live) 2022 05 04 01_16 46332369805:e <https://odysee.com/@pneuth:b/-2022-05-03--LOWTI3RGOD-(live)-2022-05-04-01_16-46332369805:e>`_

[5.5.22, 2 parts]

* [https://odysee.com/@pneuth:b/-2022-05-05--LOW-TIER-GOD-YOUTUBE-LIVE-STREAM-%F0%9F%9B%91_drake-topic_kevin-topic--super-thanks-is-live!-(5_5_2022)-2022-05-05-23_57-DA1428tiuIw:2] - `2022 05 05 LOW TIER GOD YOUTUBE LIVE STREAM %F0%9F%9B%91_drake topic_kevin topic super thanks is live! (5_5_2022) 2022 05 05 23_57 DA1428tiuIw:2 <https://odysee.com/@pneuth:b/-2022-05-05--LOW-TIER-GOD-YOUTUBE-LIVE-STREAM-%F0%9F%9B%91_drake-topic_kevin-topic--super-thanks-is-live!-(5_5_2022)-2022-05-05-23_57-DA1428tiuIw:2>`_

* [https://odysee.com/@pneuth:b/-2022-05-05--LOW-TIER-GOD-YOUTUBE-LIVE-STREAM-%F0%9F%9B%91_kevin-topic--super-thanks-is-live!-(5_5_2022)-2022-05-06-01_17-frL7SAVOVt4:a] - `2022 05 05 LOW TIER GOD YOUTUBE LIVE STREAM %F0%9F%9B%91_kevin topic super thanks is live! (5_5_2022) 2022 05 06 01_17 frL7SAVOVt4:a <https://odysee.com/@pneuth:b/-2022-05-05--LOW-TIER-GOD-YOUTUBE-LIVE-STREAM-%F0%9F%9B%91_kevin-topic--super-thanks-is-live!-(5_5_2022)-2022-05-06-01_17-frL7SAVOVt4:a>`_

* [5.5.22] - `2022 05 05 LOWTI3RGOD (live) 2022 05 06 02_33 46345723533:7 <https://odysee.com/@pneuth:b/-2022-05-05--LOWTI3RGOD-(live)-2022-05-06-02_33-46345723533:7>`_

* [5.6.22] - `2022 05 06 LOW TIER GOD YOUTUBE LIVE STREAM %F0%9F%9B%91Lets game for a bit super thanks is live! (5_6_2022) 2022 05 07 01_55 fRUDVDGqjIg:4 <https://odysee.com/@pneuth:b/-2022-05-06--LOW-TIER-GOD-YOUTUBE-LIVE-STREAM-%F0%9F%9B%91Lets-game-for-a-bit--super-thanks-is-live!-(5_6_2022)-2022-05-07-01_55-fRUDVDGqjIg:4>`_

* [V2, more content] - `GNC Stream  5_6_2022 i57XzRTW6Ew  FIXED :7 <https://odysee.com/@Dr.BroadwayMk.III:a/GNC-Stream---5_6_2022--i57XzRTW6Ew---FIXED-:7>`_

* [5.7.22] - `2022 05 08 LOWTI3RGOD (live) 2022 05 08 01_31 46359661869:a <https://odysee.com/@pneuth:b/-2022-05-08--LOWTI3RGOD-(live)-2022-05-08-01_31-46359661869:a>`_

* [5.8.22] - `2022 05 08 LOW TIER GOD YOUTUBE LIVE STREAM %F0%9F%9B%91Lets game for a bit super thanks is live! (5_8_2022) 2022 05 09 01_38 OGgF5vpgkIE:6 <https://odysee.com/@pneuth:b/-2022-05-08--LOW-TIER-GOD-YOUTUBE-LIVE-STREAM-%F0%9F%9B%91Lets-game-for-a-bit--super-thanks-is-live!-(5_8_2022)-2022-05-09-01_38-OGgF5vpgkIE:6>`_

* [5.8.22] - `2022 05 08 LOWTI3RGOD (live) 2022 05 09 02_17 46366309565:6 <https://odysee.com/@pneuth:b/-2022-05-08--LOWTI3RGOD-(live)-2022-05-09-02_17-46366309565:6>`_

* [5.9.22] - `2022 05 09 LOW TIER GOD YOUTUBE LIVE STREAM %F0%9F%9B%91GREEEN CHAT ONLY_GAMES_TOPICS_donate (5_9_2022) 2022 05 10 00_46 RQdp iB2ix8:f <https://odysee.com/@pneuth:b/-2022-05-09--LOW-TIER-GOD-YOUTUBE-LIVE-STREAM-%F0%9F%9B%91GREEEN-CHAT-ONLY_GAMES_TOPICS_donate-(5_9_2022)-2022-05-10-00_46-RQdp-iB2ix8:f>`_

* [5.9.22] - `2022 05 09 LOWTI3RGOD (live) 2022 05 10 03_59 46372645021:b <https://odysee.com/@pneuth:b/-2022-05-09--LOWTI3RGOD-(live)-2022-05-10-03_59-46372645021:b>`_

* [5.11.22] - `2022 05 11 LOW TIER GOD YOUTUBE LIVE STREAM %F0%9F%9B%91GREEEN CHAT ONLY_GAMES_TOPICS_donate (5_11_2022) 2022 05 12 00_08 tAhPGsbWvQc:c <https://odysee.com/@pneuth:b/-2022-05-11--LOW-TIER-GOD-YOUTUBE-LIVE-STREAM-%F0%9F%9B%91GREEEN-CHAT-ONLY_GAMES_TOPICS_donate-(5_11_2022)-2022-05-12-00_08-tAhPGsbWvQc:c>`_

* [5.12.22] - `2022 05 12 LOWTI3RGOD (live) 2022 05 13 00_32 46390825485:c <https://odysee.com/@pneuth:b/-2022-05-12--LOWTI3RGOD-(live)-2022-05-13-00_32-46390825485:c>`_

* [5.13.22] - `2022 05 13 LOWTI3RGOD (live) 2022 05 14 00_08 46397211965 96744233caaf4629dcfcda71f41b541f7346f55e :4 <https://odysee.com/@pneuth:b/-2022-05-13--LOWTI3RGOD-(live)-2022-05-14-00_08-46397211965--96744233caaf4629dcfcda71f41b541f7346f55e-:4>`_

* [5.14.22] - `2022 05 14 LOW TIER GOD YOUTUBE LIVE STREAM %F0%9F%9B%91GREEEN CHAT ONLY_GAMES_TOPICS_donate (5_12_2022) 2022 05 15 02_16 EEI_XUp3ZR4:7 <https://odysee.com/@pneuth:b/-2022-05-14--LOW-TIER-GOD-YOUTUBE-LIVE-STREAM-%F0%9F%9B%91GREEEN-CHAT-ONLY_GAMES_TOPICS_donate-(5_12_2022)-2022-05-15-02_16-EEI_XUp3ZR4:7>`_

* [5.15.22] - `2022 05 15 LOW TIER GOD YOUTUBE LIVE STREAM %F0%9F%9B%91GREEEN CHAT ONLY_GAMES_donate (5_15_2022) 2022 05 16 00_11 QPxsqdEFH6w:8 <https://odysee.com/@pneuth:b/-2022-05-15--LOW-TIER-GOD-YOUTUBE-LIVE-STREAM-%F0%9F%9B%91GREEEN-CHAT-ONLY_GAMES_donate-(5_15_2022)-2022-05-16-00_11-QPxsqdEFH6w:8>`_

* [5.15.22] - `2022 05 15 LOWTI3RGOD (live) 2022 05 16 03_03 46412217805:7 <https://odysee.com/@pneuth:b/-2022-05-15--LOWTI3RGOD-(live)-2022-05-16-03_03-46412217805:7>`_

* [5.16.22] - `2022 05 16 LOW TIER GOD YOUTUBE LIVE STREAM %F0%9F%9B%91GREEEN CHAT ONLY_GAMES_ect_donate (5_16_2022) 2022 05 16 23_18 D0Eu27Pnx c:5 <https://odysee.com/@pneuth:b/-2022-05-16--LOW-TIER-GOD-YOUTUBE-LIVE-STREAM-%F0%9F%9B%91GREEEN-CHAT-ONLY_GAMES_ect_donate-(5_16_2022)-2022-05-16-23_18-D0Eu27Pnx-c:5>`_

* [5.16.22] - `2022 05 16 LOWTI3RGOD (live) 2022 05 17 02_10 46418122621:a <https://odysee.com/@pneuth:b/-2022-05-16--LOWTI3RGOD-(live)-2022-05-17-02_10-46418122621:a>`_

* [5.17.22] - `2022 05 17 LOW TIER GOD YOUTUBE LIVE STREAM %F0%9F%9B%91SUB CHAT3WK_RATING TWITCH BABES (5_17_2022) 2022 05 18 00_03 qyNaaQvbFKc:4 <https://odysee.com/@pneuth:b/-2022-05-17--LOW-TIER-GOD-YOUTUBE-LIVE-STREAM-%F0%9F%9B%91SUB-CHAT3WK_RATING-TWITCH-BABES-(5_17_2022)-2022-05-18-00_03-qyNaaQvbFKc:4>`_

[5.17.22, 2 parts]

* [https://odysee.com/@pneuth:b/-2022-05-17--Lowti3rgod-(Live)-2022-05-18-03-07-46424510397:6] - `2022 05 17 Lowti3rgod (Live) 2022 05 18 03 07 46424510397:6 <https://odysee.com/@pneuth:b/-2022-05-17--Lowti3rgod-(Live)-2022-05-18-03-07-46424510397:6>`_

* [https://odysee.com/@pneuth:b/-2022-05-17--Lowti3rgod-(Live)-2022-05-18-03-20-46424536509:d] - `2022 05 17 Lowti3rgod (Live) 2022 05 18 03 20 46424536509:d <https://odysee.com/@pneuth:b/-2022-05-17--Lowti3rgod-(Live)-2022-05-18-03-20-46424536509:d>`_

* [5.18.22] - `2022 05 18 LOWTI3RGOD (live) 2022 05 19 00_30 46430246717:2 <https://odysee.com/@pneuth:b/-2022-05-18--LOWTI3RGOD-(live)-2022-05-19-00_30-46430246717:2>`_

* [5.20.22] - `2022 05 20 LOW TIER GOD YOUTUBE LIVE STREAM %F0%9F%9B%91_GAMES_topics_donate (5_20_2022) 2022 05 20 23_46 tVl tnrk7tE:e <https://odysee.com/@pneuth:b/-2022-05-20--LOW-TIER-GOD-YOUTUBE-LIVE-STREAM-%F0%9F%9B%91_GAMES_topics_donate-(5_20_2022)-2022-05-20-23_46-tVl-tnrk7tE:e>`_

* [5.20.22] - `2022 05 20 LOWTI3RGOD (live) 2022 05 21 02_07 46443051437:6 <https://odysee.com/@pneuth:b/-2022-05-20--LOWTI3RGOD-(live)-2022-05-21-02_07-46443051437:6>`_

* [5.21.22] - `2022 05 21 LOWTI3RGOD (live) 2022 05 22 46449613533 :1 <https://odysee.com/@pneuth:b/-2022-05-21--LOWTI3RGOD-(live)-2022-05-22--46449613533-:1>`_

* [5.23.22] - `2022 05 23 LOWTI3RGOD (live) 2022 05 24 03_08 46462893661:2 <https://odysee.com/@pneuth:b/-2022-05-23--LOWTI3RGOD-(live)-2022-05-24-03_08-46462893661:2>`_

* [5.24.22.] - `2022 05 24 LOWTI3RGOD (live) 2022 05 25 01_18 46468749917:c <https://odysee.com/@pneuth:b/-2022-05-24--LOWTI3RGOD-(live)-2022-05-25-01_18-46468749917:c>`_

* [5.25.22] - `2022 05 25 LOW TIER GOD YOUTUBE LIVE STREAM %F0%9F%9B%91_GAMES_topics_donate (5_25_2022) 2022 05 26 00_54 aCyyMbL_Or0 :6 <https://odysee.com/@pneuth:b/-2022-05-25--LOW-TIER-GOD-YOUTUBE-LIVE-STREAM-%F0%9F%9B%91_GAMES_topics_donate-(5_25_2022)-2022-05-26-00_54--aCyyMbL_Or0-:6>`_

* [5.26.21] - `GNC Stream  5_26_2022 7xNDcWiRWO0  FIXED :4 <https://odysee.com/@Dr.BroadwayMk.III:a/GNC-Stream---5_26_2022--7xNDcWiRWO0---FIXED-:4>`_

[5.27.22, 2 parts]

* [https://odysee.com/@pneuth:b/-2022-05-27--LOWTI3RGOD-(live)-2022-05-28-01_11-46487604445:5] - `2022 05 27 LOWTI3RGOD (live) 2022 05 28 01_11 46487604445:5 <https://odysee.com/@pneuth:b/-2022-05-27--LOWTI3RGOD-(live)-2022-05-28-01_11-46487604445:5>`_

* [https://odysee.com/@pneuth:b/-2022-05-27--LOWTI3RGOD-(live)-2022-05-28-03_49-46488114701:a] - `2022 05 27 LOWTI3RGOD (live) 2022 05 28 03_49 46488114701:a <https://odysee.com/@pneuth:b/-2022-05-27--LOWTI3RGOD-(live)-2022-05-28-03_49-46488114701:a>`_

* [5.28.22] - `2022 05 28 LOWTI3RGOD (live) 2022 05 29 01_59 46494493773:3 <https://odysee.com/@pneuth:b/-2022-05-28--LOWTI3RGOD-(live)-2022-05-29-01_59-46494493773:3>`_

* [5.29.22] - `2022 05 29 LOW TIER GOD YOUTUBE LIVE STREAM %F0%9F%9B%91_GAMES_ect_donate (5_29_2022) 2022 05 30 01_34 1nAWlKzl88s:b <https://odysee.com/@pneuth:b/-2022-05-29--LOW-TIER-GOD-YOUTUBE-LIVE-STREAM-%F0%9F%9B%91_GAMES_ect_donate-(5_29_2022)-2022-05-30-01_34-1nAWlKzl88s:b>`_

[5.29.22, 2 parts]

* [https://odysee.com/@pneuth:b/-2022-05-29--LOWTI3RGOD-(live)-2022-05-30-04_31-46501396557:6] - `2022 05 29 LOWTI3RGOD (live) 2022 05 30 04_31 46501396557:6 <https://odysee.com/@pneuth:b/-2022-05-29--LOWTI3RGOD-(live)-2022-05-30-04_31-46501396557:6>`_

* [V2, more content] - `GNC Stream  5 <https://odysee.com/@Dr.BroadwayMk.III:a/GNC-Stream---5>`_

* [5.30.22] - `2022 05 30 LOW TIER GOD YOUTUBE LIVE STREAM %F0%9F%9B%91_GAMES_donate (5_30_2022) 2022 05 30 23_39 LCVURAZUs k:0 <https://odysee.com/@pneuth:b/-2022-05-30--LOW-TIER-GOD-YOUTUBE-LIVE-STREAM-%F0%9F%9B%91_GAMES_donate-(5_30_2022)-2022-05-30-23_39-LCVURAZUs-k:0>`_

* [5.30.22] - `2022 05 30 LOWTI3RGOD (live) 2022 05 31 02_04 46507587581:7 <https://odysee.com/@pneuth:b/-2022-05-30--LOWTI3RGOD-(live)-2022-05-31-02_04-46507587581:7>`_

* [5.31.22] - `2022 05 31 LOWTI3RGOD (live) 2022 06 01 00_02 46513285773:f <https://odysee.com/@pneuth:b/-2022-05-31--LOWTI3RGOD-(live)-2022-06-01-00_02-46513285773:f>`_

June 2022
-------------

* [6.1.22] - `2022 06 01 LOW TIER GOD YOUTUBE LIVE STREAM %F0%9F%9B%91_GAMES_donate (6_1_2022) 2022 06 02 00_36 KXgx9IpUGBQ:a <https://odysee.com/@pneuth:b/-2022-06-01--LOW-TIER-GOD-YOUTUBE-LIVE-STREAM-%F0%9F%9B%91_GAMES_donate-(6_1_2022)-2022-06-02-00_36-KXgx9IpUGBQ:a>`_

[6.1.22, 2 parts]

* [https://odysee.com/@pneuth:b/-2022-06-01--LOWTI3RGOD-(live)-2022-06-02-02_54-46520255357:1] - `2022 06 01 LOWTI3RGOD (live) 2022 06 02 02_54 46520255357:1 <https://odysee.com/@pneuth:b/-2022-06-01--LOWTI3RGOD-(live)-2022-06-02-02_54-46520255357:1>`_

* [https://odysee.com/@pneuth:b/-2022-06-01--LOWTI3RGOD-(live)-2022-06-02-03_48-46520368381:4] - `2022 06 01 LOWTI3RGOD (live) 2022 06 02 03_48 46520368381:4 <https://odysee.com/@pneuth:b/-2022-06-01--LOWTI3RGOD-(live)-2022-06-02-03_48-46520368381:4>`_

* [6.2.22 Day Stream] - `2022 06 01 LOWTI3RGOD (live) 2022 06 02 17_41 46523044861:b <https://odysee.com/@pneuth:b/-2022-06-01--LOWTI3RGOD-(live)-2022-06-02-17_41-46523044861:b>`_

* [6.2.22] - `2022 06 02 LOWTI3RGOD (live) 2022 06 03 01_53 46526362061:2 <https://odysee.com/@pneuth:b/-2022-06-02--LOWTI3RGOD-(live)-2022-06-03-01_53-46526362061:2>`_

* [6.5.22] - `2022 06 05 LOW TIER GOD YOUTUBE LIVE STREAM %F0%9F%9B%91_GAMES_topics_donate (6_5_2022) 2022 06 05 23_47 aM6sQXsVhtw:8 <https://odysee.com/@pneuth:b/-2022-06-05--LOW-TIER-GOD-YOUTUBE-LIVE-STREAM-%F0%9F%9B%91_GAMES_topics_donate-(6_5_2022)-2022-06-05-23_47-aM6sQXsVhtw:8>`_

* [6.6.22] - `GNC Stream  6_6_2022 _Z7vKMeAx3A  FIXED :4 <https://odysee.com/@Dr.BroadwayMk.III:a/GNC-Stream---6_6_2022--_Z7vKMeAx3A---FIXED-:4>`_

* [6.7.22] - `2022 06 07 LOW TIER GOD YOUTUBE LIVE STREAM %F0%9F%9B%91_GAMES_topics_donate (6_7_2022) 2022 06 07 23_45 Q44S9DEqe8Q:0 <https://odysee.com/@pneuth:b/-2022-06-07--LOW-TIER-GOD-YOUTUBE-LIVE-STREAM-%F0%9F%9B%91_GAMES_topics_donate-(6_7_2022)-2022-06-07-23_45-Q44S9DEqe8Q:0>`_

* [6.8.22] - `2022 06 08 LOWTI3RGOD (live) 2022 06 09 01_58 46567309805:a <https://odysee.com/@pneuth:b/-2022-06-08--LOWTI3RGOD-(live)-2022-06-09-01_58-46567309805:a>`_

* [6.9.22 Day Stream] - `2022 06 08 LOWTI3RGOD (live) 2022 06 09 13_45 46569084717:8 <https://odysee.com/@pneuth:b/-2022-06-08--LOWTI3RGOD-(live)-2022-06-09-13_45-46569084717:8>`_

[6.9.22, 2 parts]

* [https://odysee.com/@pneuth:b/-2022-06-09--LOWTI3RGOD-(live)-2022-06-10-01_05-46573714045:3] - `2022 06 09 LOWTI3RGOD (live) 2022 06 10 01_05 46573714045:3 <https://odysee.com/@pneuth:b/-2022-06-09--LOWTI3RGOD-(live)-2022-06-10-01_05-46573714045:3>`_

* [https://odysee.com/@pneuth:b/-2022-06-09--LOWTI3RGOD-(live)-2022-06-10-01_40-46573862877:3] - `2022 06 09 LOWTI3RGOD (live) 2022 06 10 01_40 46573862877:3 <https://odysee.com/@pneuth:b/-2022-06-09--LOWTI3RGOD-(live)-2022-06-10-01_40-46573862877:3>`_

* [6.10.22] - `2022 06 10 LOW TIER GOD YOUTUBE LIVE STREAM %F0%9F%9B%91_GAMES_topics_donate (6_10_2022) 2022 06 10 23_47 ltQrUgg2_6Q:1 <https://odysee.com/@pneuth:b/-2022-06-10--LOW-TIER-GOD-YOUTUBE-LIVE-STREAM-%F0%9F%9B%91_GAMES_topics_donate-(6_10_2022)-2022-06-10-23_47-ltQrUgg2_6Q:1>`_

[6.10.22, 2 parts]

* [https://odysee.com/@pneuth:b/-2022-06-09--LOWTI3RGOD-(live)-2022-06-11-02_46-46580859181:2] - `2022 06 09 LOWTI3RGOD (live) 2022 06 11 02_46 46580859181:2 <https://odysee.com/@pneuth:b/-2022-06-09--LOWTI3RGOD-(live)-2022-06-11-02_46-46580859181:2>`_

* [https://odysee.com/@pneuth:b/-2022-06-10--LOWTI3RGOD-(live)-2022-06-11-04_51-46581163725:e] - `2022 06 10 LOWTI3RGOD (live) 2022 06 11 04_51 46581163725:e <https://odysee.com/@pneuth:b/-2022-06-10--LOWTI3RGOD-(live)-2022-06-11-04_51-46581163725:e>`_

* [6.11.22] - `2022 06 11 LOWTI3RGOD (live) 2022 06 12 02_19 46587915309:d <https://odysee.com/@pneuth:b/-2022-06-11--LOWTI3RGOD-(live)-2022-06-12-02_19-46587915309:d>`_

* [6.12.22] - `2022 06 12 LOW TIER GOD YOUTUBE LIVE STREAM %F0%9F%9B%91_GAMES_etc_donate (6_12_2022) 2022 06 12 23_32 gnr4pedWFks:3 <https://odysee.com/@pneuth:b/-2022-06-12--LOW-TIER-GOD-YOUTUBE-LIVE-STREAM-%F0%9F%9B%91_GAMES_etc_donate-(6_12_2022)-2022-06-12-23_32-gnr4pedWFks:3>`_

* [6.13.22 Day Stream] - `2022 06 12 LOWTI3RGOD (live) 2022 06 13 17_35 46597848397:8 <https://odysee.com/@pneuth:b/-2022-06-12--LOWTI3RGOD-(live)-2022-06-13-17_35-46597848397:8>`_

* [6.13.22] - `LOWTI3RGOD (live) 2022 06 14 01_53 46601383885:9 <https://odysee.com/@pneuth:b/LOWTI3RGOD-(live)-2022-06-14-01_53-46601383885:9>`_

* [6.14.22] - `2022 06 14 LOW TIER GOD YOUTUBE LIVE STREAM %F0%9F%9B%91_GAMES_etc_donate (6_4_2022) 2022 06 15 01_31 UCVAAarjN c:9 <https://odysee.com/@pneuth:b/-2022-06-14--LOW-TIER-GOD-YOUTUBE-LIVE-STREAM-%F0%9F%9B%91_GAMES_etc_donate-(6_4_2022)-2022-06-15-01_31-UCVAAarjN-c:9>`_

* [6.15.22] - `2022 06 15 LOWTI 3 RGOD (live) 2022 06 16 46614457693 :0 <https://odysee.com/@pneuth:b/-2022-06-15--LOWTI-3-RGOD-(live)-2022-06-16--46614457693-:0>`_

* [6.18.22] - `2022 06 18 LOW TIER GOD YOUTUBE LIVE STREAM %F0%9F%9B%91_GAMES_etc_donate (6_15_2022) 2022 06 18 23_52 TEL7xf91mWY:2 <https://odysee.com/@pneuth:b/-2022-06-18--LOW-TIER-GOD-YOUTUBE-LIVE-STREAM-%F0%9F%9B%91_GAMES_etc_donate-(6_15_2022)-2022-06-18-23_52-TEL7xf91mWY:2>`_

* [6.20.22] - `2022 06 20 LOW TIER GOD YOUTUBE LIVE STREAM %F0%9F%9B%91_GAMES_etc_donate (6_20_2022) 2022 06 20 23_33 qReQ0GCdTN4:c <https://odysee.com/@pneuth:b/-2022-06-20--LOW-TIER-GOD-YOUTUBE-LIVE-STREAM-%F0%9F%9B%91_GAMES_etc_donate-(6_20_2022)-2022-06-20-23_33-qReQ0GCdTN4:c>`_

* [6.21.22] - `2022 06 21 LOW TIER GOD YOUTUBE LIVE STREAM %F0%9F%9B%91_classics_etc_donate (6_21_2022) 2022 06 22 01_09 FO7 BjnFmvs:d <https://odysee.com/@pneuth:b/-2022-06-21--LOW-TIER-GOD-YOUTUBE-LIVE-STREAM-%F0%9F%9B%91_classics_etc_donate-(6_21_2022)-2022-06-22-01_09-FO7-BjnFmvs:d>`_

* [6.21.22] - `2022 06 21 LOW TIER GOD YOUTUBE LIVE STREAM %F0%9F%9B%91_classics_etc_donate (6_21_2022) 2022 06 22 01_09 FO7 BjnFmvs:d <https://odysee.com/@pneuth:b/-2022-06-21--LOW-TIER-GOD-YOUTUBE-LIVE-STREAM-%F0%9F%9B%91_classics_etc_donate-(6_21_2022)-2022-06-22-01_09-FO7-BjnFmvs:d>`_

[6.23.22, 2 parts]

* [https://odysee.com/@pneuth:b/-2022-06-23--GNC-Stream---6_23_2022--Jf-4K3F1ceo---FIXED---CLIP-:8] - `2022 06 23 GNC Stream  6_23_2022 Jf 4K3F1ceo  FIXED  CLIP :8 <https://odysee.com/@pneuth:b/-2022-06-23--GNC-Stream---6_23_2022--Jf-4K3F1ceo---FIXED---CLIP-:8>`_

* [Mirror] - `GNC Stream  6_23_2022 Jf 4K3F1ceo  FIXED :1 <https://odysee.com/@Dr.BroadwayMk.III:a/GNC-Stream---6_23_2022--Jf-4K3F1ceo---FIXED-:1>`_

* [https://odysee.com/@pneuth:b/-2022-06-23--LOW-TIER-GOD-YOUTUBE-LIVE-STREAM-%F0%9F%9B%91_GAMES_capcome-fighting-collection-(6_23_2022)-2022-06-24-03_25-2AkQPrct08I:f] - `2022 06 23 LOW TIER GOD YOUTUBE LIVE STREAM %F0%9F%9B%91_GAMES_capcome fighting collection (6_23_2022) 2022 06 24 03_25 2AkQPrct08I:f <https://odysee.com/@pneuth:b/-2022-06-23--LOW-TIER-GOD-YOUTUBE-LIVE-STREAM-%F0%9F%9B%91_GAMES_capcome-fighting-collection-(6_23_2022)-2022-06-24-03_25-2AkQPrct08I:f>`_

* [6.25.22] - `2022 06 25 LOW TIER GOD YOUTUBE LIVE STREAM %F0%9F%9B%91_GAMES_etc_CLASSICS_donatE (6_25_2022) 2022 06 26 01_35 g8_gALmqTGE:e <https://odysee.com/@pneuth:b/-2022-06-25--LOW-TIER-GOD-YOUTUBE-LIVE-STREAM-%F0%9F%9B%91_GAMES_etc_CLASSICS_donatE-(6_25_2022)-2022-06-26-01_35-g8_gALmqTGE:e>`_

* [6.26.22] - `2022 06 26 LOW TIER GOD YOUTUBE LIVE STREAM %F0%9F%9B%91_GAMES_etc_CLASSICS_donatE (6_26_2022) 2022 06 27 02_29 SgSIxpJHR5o:0 <https://odysee.com/@pneuth:b/-2022-06-26--LOW-TIER-GOD-YOUTUBE-LIVE-STREAM-%F0%9F%9B%91_GAMES_etc_CLASSICS_donatE-(6_26_2022)-2022-06-27-02_29-SgSIxpJHR5o:0>`_

* [6.28.22] - `2022 06 28 LOW TIER GOD YOUTUBE LIVE STREAM %F0%9F%9B%91_dnf duel_etc_CLASSICS_donatE (6_28_2022) 2022 06 28 23_51 p90bk8Ary I:5 <https://odysee.com/@pneuth:b/-2022-06-28--LOW-TIER-GOD-YOUTUBE-LIVE-STREAM-%F0%9F%9B%91_dnf-duel_etc_CLASSICS_donatE-(6_28_2022)-2022-06-28-23_51-p90bk8Ary-I:5>`_

* [6.29.22] - `2022 06 29 LOW TIER GOD YOUTUBE LIVE STREAM %F0%9F%9B%91GAMES_topics_ (6_29_2022) 2022 06 30 02_16 gqAnbIY7NK0:f <https://odysee.com/@pneuth:b/-2022-06-29--LOW-TIER-GOD-YOUTUBE-LIVE-STREAM-%F0%9F%9B%91GAMES_topics_-(6_29_2022)-2022-06-30-02_16-gqAnbIY7NK0:f>`_

* [6.30.22] - `2022 06 30 LOW TIER GOD YOUTUBE LIVE STREAM %F0%9F%9B%91_dnf duel_etc_topics_donatE (6_30_2022) 12TTxDn6rh0 :4 <https://odysee.com/@pneuth:b/-2022-06-30--LOW-TIER-GOD-YOUTUBE-LIVE-STREAM-%F0%9F%9B%91_dnf-duel_etc_topics_donatE-(6_30_2022)--12TTxDn6rh0-:4>`_

July 2022
-------------

* [7.1.22] - `LOW TIER GOD YOUTUBE LIVE STREAM %F0%9F%9B%91GAMES_topics (7_1_2022) 2022 07 02 01_16 3ySpkMIH2ho:1 <https://odysee.com/@pneuth:b/LOW-TIER-GOD-YOUTUBE-LIVE-STREAM-%F0%9F%9B%91GAMES_topics-(7_1_2022)-2022-07-02-01_16-3ySpkMIH2ho:1>`_

* [7.2.22] - `LOWTI3RGOD (live) 2022 07 03 03_25 40938906155:1 <https://odysee.com/@pneuth:b/LOWTI3RGOD-(live)-2022-07-03-03_25-40938906155:1>`_

* [7.3.22] - `LOW TIER GOD YOUTUBE LIVE STREAM %F0%9F%9B%91_GAMES_SMASH_ETC THEN TWITCH_donatE (7_3_2022) 2022 07 04 01_38 o20YwvAFQWY:a <https://odysee.com/@pneuth:b/LOW-TIER-GOD-YOUTUBE-LIVE-STREAM-%F0%9F%9B%91_GAMES_SMASH_ETC-THEN-TWITCH_donatE-(7_3_2022)-2022-07-04-01_38-o20YwvAFQWY:a>`_

* [7.5.22] - `LOWTI3RGOD (live) 2022 07 06 00_33 40949551563:1 <https://odysee.com/@pneuth:b/LOWTI3RGOD-(live)-2022-07-06-00_33-40949551563:1>`_

* [7.6.22] - `LOW TIER GOD YOUTUBE LIVE STREAM %F0%9F%9B%91_GAMES_SMASH_ETC_donatE (7_6_2022) 2022 07 07 02_11 HPA6ub7LFLs:4 <https://odysee.com/@pneuth:b/LOW-TIER-GOD-YOUTUBE-LIVE-STREAM-%F0%9F%9B%91_GAMES_SMASH_ETC_donatE-(7_6_2022)-2022-07-07-02_11-HPA6ub7LFLs:4>`_

* [7.7.22] - `LOW TIER GOD YOUTUBE LIVE STREAM %F0%9F%9B%91_dnf_SMASH_ETC_donatE (7_7_2022) 2022 07 08 02_04 9 rOHQ59PG0:1 <https://odysee.com/@pneuth:b/LOW-TIER-GOD-YOUTUBE-LIVE-STREAM-%F0%9F%9B%91_dnf_SMASH_ETC_donatE-(7_7_2022)-2022-07-08-02_04-9-rOHQ59PG0:1>`_

* [7.8.22] - `LOW TIER GOD YOUTUBE LIVE STREAM %F0%9F%9B%91_games_Short_ETC_donatE (7_8_2022) 2022 07 09 02_44 krYQSzGbku8:d <https://odysee.com/@pneuth:b/LOW-TIER-GOD-YOUTUBE-LIVE-STREAM-%F0%9F%9B%91_games_Short_ETC_donatE-(7_8_2022)-2022-07-09-02_44-krYQSzGbku8:d>`_

* [7.11.22] - `LOW TIER GOD YOUTUBE LIVE STREAM %F0%9F%9B%91_games_classics_ETC_donatE (7_11_2022) 2022 07 12 00_08 EjoAQkD_gUo:e <https://odysee.com/@pneuth:b/LOW-TIER-GOD-YOUTUBE-LIVE-STREAM-%F0%9F%9B%91_games_classics_ETC_donatE-(7_11_2022)-2022-07-12-00_08-EjoAQkD_gUo:e>`_

* [7.12.22] - `LOW TIER GOD YOUTUBE LIVE STREAM %F0%9F%9B%91_games_classics_topics_donatE (7_12_2022) 2022 07 12 23_59 i6mPQJWE6Gc:9 <https://odysee.com/@pneuth:b/LOW-TIER-GOD-YOUTUBE-LIVE-STREAM-%F0%9F%9B%91_games_classics_topics_donatE-(7_12_2022)-2022-07-12-23_59-i6mPQJWE6Gc:9>`_

* [7.13.22] - `LOW TIER GOD YOUTUBE LIVE STREAM %F0%9F%9B%91_games_classics_topics_donatE (7_13_2022) 2022 07 14 02_22 QVAm4ApDrr4:8 <https://odysee.com/@pneuth:b/LOW-TIER-GOD-YOUTUBE-LIVE-STREAM-%F0%9F%9B%91_games_classics_topics_donatE-(7_13_2022)-2022-07-14-02_22-QVAm4ApDrr4:8>`_

* [7.14.22] - `LOW TIER GOD YOUTUBE LIVE STREAM %F0%9F%9B%91_games_classics_topics_donatE (7_14_2022) 2022 07 15 02_09 gX4NGKZTLPw:d <https://odysee.com/@pneuth:b/LOW-TIER-GOD-YOUTUBE-LIVE-STREAM-%F0%9F%9B%91_games_classics_topics_donatE-(7_14_2022)-2022-07-15-02_09-gX4NGKZTLPw:d>`_

* [7.15.22] - `LOW TIER GOD YOUTUBE LIVE STREAM %F0%9F%9B%91_games_classics_short_donatE (7_15_2022) 2022 07 16 00_10 HGVswaeoJsE:f <https://odysee.com/@pneuth:b/LOW-TIER-GOD-YOUTUBE-LIVE-STREAM-%F0%9F%9B%91_games_classics_short_donatE-(7_15_2022)-2022-07-16-00_10-HGVswaeoJsE:f>`_

[7.16.22, 2 parts]

LOW-TIER-GOD-YOUTUBE-LIVE-STREAM-_games_classics_short_donatE-(7_16_2022)-2022-07-17-02_43-zedsl_9TjAo

[7.16.22] LOW TIER GOD YOUTUBE LIVE STREAM  Games Classics Short Donat E ( 7 16 2022) 2022 07 17 [L9ytiat9bLQ]

* [7.17.22] - `GNC Stream  7_17_2022 AhwN63uNV5Q :f <https://odysee.com/@pneuth:b/GNC-Stream---7_17_2022--AhwN63uNV5Q-:f>`_

* [Mirror] - `GNC Stream  7_17_2022 AhwN63uNV5Q :8 <https://odysee.com/@Dr.BroadwayMk.III:a/GNC-Stream---7_17_2022--AhwN63uNV5Q-:8>`_

* [7.19.22] - `LOW TIER GOD YOUTUBE LIVE STREAM %F0%9F%9B%91_stray_multversus_etc_donatE (7_19_2022) 2022 07 20 00_13 0KfKD6HJNX4:c <https://odysee.com/@pneuth:b/LOW-TIER-GOD-YOUTUBE-LIVE-STREAM-%F0%9F%9B%91_stray_multversus_etc_donatE-(7_19_2022)-2022-07-20-00_13-0KfKD6HJNX4:c>`_

* [7.20.22] - `LOW TIER GOD YOUTUBE LIVE STREAM %F0%9F%9B%91_stray_games_etc_donatE (7_20_2022) 5BBj8fgGUnw:5 <https://odysee.com/@pneuth:b/LOW-TIER-GOD-YOUTUBE-LIVE-STREAM-%F0%9F%9B%91_stray_games_etc_donatE-(7_20_2022)-5BBj8fgGUnw:5>`_

* [7.21.22] - `LOW TIER GOD YOUTUBE LIVE STREAM %F0%9F%9B%91_stray_games_etc_donatE (7_21_2022) bfQY00kwB50:3 <https://odysee.com/@pneuth:b/LOW-TIER-GOD-YOUTUBE-LIVE-STREAM-%F0%9F%9B%91_stray_games_etc_donatE-(7_21_2022)-bfQY00kwB50:3>`_

* [7.24.22] - `LOW TIER GOD YOUTUBE LIVE STREAM %F0%9F%9B%91_stray_games_reaction_donatE (7_24_2022) 2022 07 24 23_32 GGKhGteuuYM:6 <https://odysee.com/@pneuth:b/LOW-TIER-GOD-YOUTUBE-LIVE-STREAM-%F0%9F%9B%91_stray_games_reaction_donatE-(7_24_2022)-2022-07-24-23_32-GGKhGteuuYM:6>`_

* [7.25.22] - `LOW TIER GOD YOUTUBE LIVE STREAM %F0%9F%9B%91_games_SINGLE_donatE (7_25_2022) 2022 07 26 00_30 mfYMrypc9gg:d <https://odysee.com/@pneuth:b/LOW-TIER-GOD-YOUTUBE-LIVE-STREAM-%F0%9F%9B%91_games_SINGLE_donatE-(7_25_2022)-2022-07-26-00_30-mfYMrypc9gg:d>`_

* [7.26.22] - `LOW TIER GOD YOUTUBE LIVE STREAM %F0%9F%9B%91_games_sp_donatE (7_26_2022) 2022 07 27 00_33 JhZaA8h9shQ:c <https://odysee.com/@pneuth:b/LOW-TIER-GOD-YOUTUBE-LIVE-STREAM-%F0%9F%9B%91_games_sp_donatE-(7_26_2022)-2022-07-27-00_33-JhZaA8h9shQ:c>`_

[7.27.22]

* [7.29.22] - `LOW TIER GOD YOUTUBE LIVE STREAM %F0%9F%9B%91_games_topic_sp_donatE (7_29_2022) 2022 07 30 00_07 hyKoXCLs_cw:9 <https://odysee.com/@pneuth:b/LOW-TIER-GOD-YOUTUBE-LIVE-STREAM-%F0%9F%9B%91_games_topic_sp_donatE-(7_29_2022)-2022-07-30-00_07-hyKoXCLs_cw:9>`_

August 2022
-------------

* [8.1.22] - `LOW TIER GOD YOUTUBE LIVE STREAM %F0%9F%9B%91_games_sp_donatE (8_1_2022) 2022 08 02 00_53 iXygxhupt84:f <https://odysee.com/@pneuth:b/LOW-TIER-GOD-YOUTUBE-LIVE-STREAM-%F0%9F%9B%91_games_sp_donatE-(8_1_2022)-2022-08-02-00_53-iXygxhupt84:f>`_

* [8.2.22] - `LOW TIER GOD YOUTUBE LIVE STREAM %F0%9F%9B%91_games_topic_donatE (8_2_2022) 2022 08 03 00_46 12rX_yUjke8:5 <https://odysee.com/@pneuth:b/LOW-TIER-GOD-YOUTUBE-LIVE-STREAM-%F0%9F%9B%91_games_topic_donatE-(8_2_2022)-2022-08-03-00_46-12rX_yUjke8:5>`_

* [8.3.22] - `LOW TIER GOD YOUTUBE LIVE STREAM %F0%9F%9B%91_games_topic_donatE (8_3_2022) 2022 08 04 01_40 V8tw0n rCpM:8 <https://odysee.com/@pneuth:b/LOW-TIER-GOD-YOUTUBE-LIVE-STREAM-%F0%9F%9B%91_games_topic_donatE-(8_3_2022)-2022-08-04-01_40-V8tw0n-rCpM:8>`_

* [8.4.22] - `LOW TIER GOD YOUTUBE LIVE STREAM %F0%9F%9B%91_games_donatE (8_4_2022) 2022 08 04 22_26 vOGrKiYLCv0:7 <https://odysee.com/@pneuth:b/LOW-TIER-GOD-YOUTUBE-LIVE-STREAM-%F0%9F%9B%91_games_donatE-(8_4_2022)-2022-08-04-22_26-vOGrKiYLCv0:7>`_

* [8.6.22] - `LOW TIER GOD YOUTUBE LIVE STREAM %F0%9F%9B%91_games_donatE (8_6_2022) 2022 08 07 01_26 _1wu4iv8EGw:e <https://odysee.com/@pneuth:b/LOW-TIER-GOD-YOUTUBE-LIVE-STREAM-%F0%9F%9B%91_games_donatE-(8_6_2022)-2022-08-07-01_26-_1wu4iv8EGw:e>`_

[8.7.22, 2 parts]

* [https://odysee.com/@pneuth:b/LOW-TIER-GOD-YOUTUBE-LIVE-STREAM-%F0%9F%9B%91_games_donatE-(8_7_2022)-2022-08-07-20_23-4Suj3QXHkxM:5] - `LOW TIER GOD YOUTUBE LIVE STREAM %F0%9F%9B%91_games_donatE (8_7_2022) 2022 08 07 20_23 4Suj3QXHkxM:5 <https://odysee.com/@pneuth:b/LOW-TIER-GOD-YOUTUBE-LIVE-STREAM-%F0%9F%9B%91_games_donatE-(8_7_2022)-2022-08-07-20_23-4Suj3QXHkxM:5>`_

* [https://odysee.com/@pneuth:b/LOW-TIER-GOD-YOUTUBE-LIVE-STREAM-%F0%9F%9B%91_games_donatE-(8_6_2022)-2022-08-08-01_25--KtQZZwLm524-:c] - `LOW TIER GOD YOUTUBE LIVE STREAM %F0%9F%9B%91_games_donatE (8_6_2022) 2022 08 08 01_25 KtQZZwLm524 :c <https://odysee.com/@pneuth:b/LOW-TIER-GOD-YOUTUBE-LIVE-STREAM-%F0%9F%9B%91_games_donatE-(8_6_2022)-2022-08-08-01_25--KtQZZwLm524-:c>`_

* [8.8.22] - `LOW TIER GOD YOUTUBE LIVE STREAM %F0%9F%9B%91_games_donatE (8_8_2022) 2022 08 09 02_02 Ehu4AzY009Q:8 <https://odysee.com/@pneuth:b/LOW-TIER-GOD-YOUTUBE-LIVE-STREAM-%F0%9F%9B%91_games_donatE-(8_8_2022)-2022-08-09-02_02-Ehu4AzY009Q:8>`_

* [8.9.22] - `LOW TIER GOD YOUTUBE LIVE STREAM %F0%9F%9B%91_games_donatE (8_9_2022) 2022 08 10 00_57 fla_0xmVAYo:3 <https://odysee.com/@pneuth:b/LOW-TIER-GOD-YOUTUBE-LIVE-STREAM-%F0%9F%9B%91_games_donatE-(8_9_2022)-2022-08-10-00_57-fla_0xmVAYo:3>`_

* [8.11.22] - `LOW TIER GOD YOUTUBE LIVE STREAM %F0%9F%9B%91_games_donatE (8_11_2022) 2022 08 12 01_56 9HOyWs2khbQ:0 <https://odysee.com/@pneuth:b/LOW-TIER-GOD-YOUTUBE-LIVE-STREAM-%F0%9F%9B%91_games_donatE-(8_11_2022)-2022-08-12-01_56-9HOyWs2khbQ:0>`_

* [8.12.22] - `LOW TIER GOD YOUTUBE LIVE STREAM %F0%9F%9B%91_games etc_donatE (8_12_2022) 2022 08 13 01_56 bvJfomA66NQ:9 <https://odysee.com/@pneuth:b/LOW-TIER-GOD-YOUTUBE-LIVE-STREAM-%F0%9F%9B%91_games-etc_donatE-(8_12_2022)-2022-08-13-01_56-bvJfomA66NQ:9>`_

* [8.13.22] - `LOW TIER GOD YOUTUBE LIVE STREAM %F0%9F%9B%91_games etc_donatE (8_13_2022) 2022 08 14 02_09 FjzxgnPameY:5 <https://odysee.com/@pneuth:b/LOW-TIER-GOD-YOUTUBE-LIVE-STREAM-%F0%9F%9B%91_games-etc_donatE-(8_13_2022)-2022-08-14-02_09-FjzxgnPameY:5>`_

[8.14.22]

* [https://odysee.com/@pneuth:b/LOWTI3RGOD-(live)-2022-08-15-01_40-41122262891:3] - `LOWTI3RGOD (live) 2022 08 15 01_40 41122262891:3 <https://odysee.com/@pneuth:b/LOWTI3RGOD-(live)-2022-08-15-01_40-41122262891:3>`_

* [https://odysee.com/@pneuth:b/LOWTI3RGOD-(live)-2022-08-15-04_18-41122684155:4] - `LOWTI3RGOD (live) 2022 08 15 04_18 41122684155:4 <https://odysee.com/@pneuth:b/LOWTI3RGOD-(live)-2022-08-15-04_18-41122684155:4>`_

* [8.15.22] - `LOW TIER GOD YOUTUBE LIVE STREAM %F0%9F%9B%91_games_etc_donatE (8_15_2022) 2022 08 16 00_54 X5DJVSwe Jw:8 <https://odysee.com/@pneuth:b/LOW-TIER-GOD-YOUTUBE-LIVE-STREAM-%F0%9F%9B%91_games_etc_donatE-(8_15_2022)-2022-08-16-00_54-X5DJVSwe-Jw:8>`_

[8.16.22, 2 parts]

* [https://odysee.com/@pneuth:b/LOWTI3RGOD-(live)-2022-08-17-03_24-41130984875:9] - `LOWTI3RGOD (live) 2022 08 17 03_24 41130984875:9 <https://odysee.com/@pneuth:b/LOWTI3RGOD-(live)-2022-08-17-03_24-41130984875:9>`_

* [https://odysee.com/@pneuth:b/LOWTI3RGOD-(live)-2022-08-17-04_40-41131163979:9] - `LOWTI3RGOD (live) 2022 08 17 04_40 41131163979:9 <https://odysee.com/@pneuth:b/LOWTI3RGOD-(live)-2022-08-17-04_40-41131163979:9>`_

* [8.17.22] - `LOW TIER GOD YOUTUBE LIVE STREAM %F0%9F%9B%91games_tekken_etc (8_17_2022) 2022 08 18 00_48 jU63aM2C4vY:5 <https://odysee.com/@pneuth:b/LOW-TIER-GOD-YOUTUBE-LIVE-STREAM-%F0%9F%9B%91games_tekken_etc-(8_17_2022)-2022-08-18-00_48-jU63aM2C4vY:5>`_

[8.19.22, 2 parts]

* [https://odysee.com/@pneuth:b/LOW-TIER-GOD-YOUTUBE-LIVE-STREAM-%F0%9F%9B%91games_tekken_topics-(8_19_2022)-2022-08-20-00_51-EwUg-tWTIa8:5] - `LOW TIER GOD YOUTUBE LIVE STREAM %F0%9F%9B%91games_tekken_topics (8_19_2022) 2022 08 20 00_51 EwUg tWTIa8:5 <https://odysee.com/@pneuth:b/LOW-TIER-GOD-YOUTUBE-LIVE-STREAM-%F0%9F%9B%91games_tekken_topics-(8_19_2022)-2022-08-20-00_51-EwUg-tWTIa8:5>`_

* [https://odysee.com/@pneuth:b/LOW-TIER-GOD-YOUTUBE-LIVE-STREAM-%F0%9F%9B%91games_tekken_topics-(8_19_2022)-2022-08-20-02_05-85mrel7G-QI:8] - `LOW TIER GOD YOUTUBE LIVE STREAM %F0%9F%9B%91games_tekken_topics (8_19_2022) 2022 08 20 02_05 85mrel7G QI:8 <https://odysee.com/@pneuth:b/LOW-TIER-GOD-YOUTUBE-LIVE-STREAM-%F0%9F%9B%91games_tekken_topics-(8_19_2022)-2022-08-20-02_05-85mrel7G-QI:8>`_

* [8.20.22] - `LOWTI3RGOD (live) 2022 08 21 03_03 41147994875:7 <https://odysee.com/@pneuth:b/LOWTI3RGOD-(live)-2022-08-21-03_03-41147994875:7>`_

* [8.21.22] - `LOW TIER GOD YOUTUBE LIVE STREAM %F0%9F%9B%91 NEW MERCH DROP_games_etc_ (8_21_2022) 2022 08 22 02_02 e0mFhSwhWqA:8 <https://odysee.com/@pneuth:b/LOW-TIER-GOD-YOUTUBE-LIVE-STREAM-%F0%9F%9B%91-NEW-MERCH-DROP_games_etc_-(8_21_2022)-2022-08-22-02_02-e0mFhSwhWqA:8>`_

* [8.22.22] - `Lowti3rgod (Live) 2022 08 23 01 25 41155634059  FIXED :0 <https://odysee.com/@pneuth:b/Lowti3rgod-(Live)-2022-08-23-01-25--41155634059---FIXED-:0>`_

[8.23.22, 2 parts]

* [https://odysee.com/@pneuth:b/LOWTI3RGOD-(live)-2022-08-24-01_52-41159968347:d] - `LOWTI3RGOD (live) 2022 08 24 01_52 41159968347:d <https://odysee.com/@pneuth:b/LOWTI3RGOD-(live)-2022-08-24-01_52-41159968347:d>`_

* [https://odysee.com/@pneuth:b/LOWTI3RGOD-(live)-2022-08-24-04_05-41160311371:7] - `LOWTI3RGOD (live) 2022 08 24 04_05 41160311371:7 <https://odysee.com/@pneuth:b/LOWTI3RGOD-(live)-2022-08-24-04_05-41160311371:7>`_

* [8.24.22] - `LOW TIER GOD YOUTUBE LIVE STREAM %F0%9F%9B%91 NEW MERCH DROP_games_topics_ (8_24_2022) 2022 08 25 00_39 pthdE1yesKQ:0 <https://odysee.com/@pneuth:b/LOW-TIER-GOD-YOUTUBE-LIVE-STREAM-%F0%9F%9B%91-NEW-MERCH-DROP_games_topics_-(8_24_2022)-2022-08-25-00_39-pthdE1yesKQ:0>`_

* [8.25.22] - `LOW TIER GOD YOUTUBE LIVE STREAM %F0%9F%9B%91 NEW MERCH DROP_games_short_ (8_25_2022) 2022 08 26 02_42 5dxVzKg_HFs:b <https://odysee.com/@pneuth:b/LOW-TIER-GOD-YOUTUBE-LIVE-STREAM-%F0%9F%9B%91-NEW-MERCH-DROP_games_short_-(8_25_2022)-2022-08-26-02_42-5dxVzKg_HFs:b>`_

* [8.26.22] - `LOW TIER GOD YOUTUBE LIVE STREAM %F0%9F%9B%91 NEW MERCH DROP_games_topics_ (8_26_2022) 2022 08 27 01_17 oDsE2dIxp00:5 <https://odysee.com/@pneuth:b/LOW-TIER-GOD-YOUTUBE-LIVE-STREAM-%F0%9F%9B%91-NEW-MERCH-DROP_games_topics_-(8_26_2022)-2022-08-27-01_17-oDsE2dIxp00:5>`_

* [8.27.22] - `LOWTI3RGOD (live) 2022 08 28 00_45 41183965003:d <https://odysee.com/@pneuth:b/LOWTI3RGOD-(live)-2022-08-28-00_45-41183965003:d>`_

[8.28.22, 3 parts]

* [https://odysee.com/@pneuth:b/LOWTI3RGOD-(live)-2022-08-29-00_35-41190671723:9] - `LOWTI3RGOD (live) 2022 08 29 00_35 41190671723:9 <https://odysee.com/@pneuth:b/LOWTI3RGOD-(live)-2022-08-29-00_35-41190671723:9>`_

* [https://odysee.com/@pneuth:b/LOWTI3RGOD-(live)-2022-08-29-04_01-41191368811:a] - `LOWTI3RGOD (live) 2022 08 29 04_01 41191368811:a <https://odysee.com/@pneuth:b/LOWTI3RGOD-(live)-2022-08-29-04_01-41191368811:a>`_

* [https://odysee.com/@pneuth:b/LOWTI3RGOD-(live)-2022-08-29-00_18-41190582379:8] - `LOWTI3RGOD (live) 2022 08 29 00_18 41190582379:8 <https://odysee.com/@pneuth:b/LOWTI3RGOD-(live)-2022-08-29-00_18-41190582379:8>`_

* [8.30.22] - `%F0%9F%9B%91LOW TIER GOD YOUTUBE LIVE STREAM%F0%9F%9B%91_games etc_ (8_30_2022) 2022 08 30 23_15 OXpHkxM8G4g:a <https://odysee.com/@pneuth:b/%F0%9F%9B%91LOW-TIER-GOD-YOUTUBE-LIVE-STREAM%F0%9F%9B%91_games-etc_-(8_30_2022)-2022-08-30-23_15-OXpHkxM8G4g:a>`_


* [8.31.22] - `%F0%9F%9B%91LOW TIER GOD YOUTUBE LIVE STREAM%F0%9F%9B%91_games etc_ (8_31_2022) 2022 09 01 02_19 SwwhwWMmTck:a <https://odysee.com/@pneuth:b/%F0%9F%9B%91LOW-TIER-GOD-YOUTUBE-LIVE-STREAM%F0%9F%9B%91_games-etc_-(8_31_2022)-2022-09-01-02_19-SwwhwWMmTck:a>`_

* [8.31.22] - `LOWTI3RGOD (live) 2022 09 01 01_12 41206081227:4 <https://odysee.com/@pneuth:b/LOWTI3RGOD-(live)-2022-09-01-01_12-41206081227:4>`_

September 2022
--------------

* [9.1.22] - `LOWTI3RGOD (live) 2022 09 01 23_48 41210013835:a <https://odysee.com/@pneuth:b/LOWTI3RGOD-(live)-2022-09-01-23_48-41210013835:a>`_

* [9.3.22] - `%F0%9F%9B%91LOW TIER GOD YOUTUBE LIVE STREAM%F0%9F%9B%91tlou_games_etc_ (9_3_2022) 2022 09 04 02_19 C7KrH3nZo4A:5 <https://odysee.com/@pneuth:b/%F0%9F%9B%91LOW-TIER-GOD-YOUTUBE-LIVE-STREAM%F0%9F%9B%91tlou_games_etc_-(9_3_2022)-2022-09-04-02_19-C7KrH3nZo4A:5>`_

* [9.4.22] - `%F0%9F%9B%91LOW TIER GOD YOUTUBE LIVE STREAM%F0%9F%9B%91tlou_games_etc_ (9_4_2022) 2022 09 05 02_28 k9jDo9PWSyg:4 <https://odysee.com/@pneuth:b/%F0%9F%9B%91LOW-TIER-GOD-YOUTUBE-LIVE-STREAM%F0%9F%9B%91tlou_games_etc_-(9_4_2022)-2022-09-05-02_28-k9jDo9PWSyg:4>`_

* [9.5.22] - `%F0%9F%9B%91LOW TIER GOD YOUTUBE LIVE STREAM%F0%9F%9B%91tlou_games_etc_ (9_5_2022) 2022 09 05 23_59 Z72gA75 Gso:f <https://odysee.com/@pneuth:b/%F0%9F%9B%91LOW-TIER-GOD-YOUTUBE-LIVE-STREAM%F0%9F%9B%91tlou_games_etc_-(9_5_2022)-2022-09-05-23_59-Z72gA75-Gso:f>`_

* [9.6.22] - `%F0%9F%9B%91LOW TIER GOD YOUTUBE LIVE STREAM%F0%9F%9B%91tlou_games_etc_ (9_6_2022) 2022 09 07 00_47 YioCIxNMQos:9 <https://odysee.com/@pneuth:b/%F0%9F%9B%91LOW-TIER-GOD-YOUTUBE-LIVE-STREAM%F0%9F%9B%91tlou_games_etc_-(9_6_2022)-2022-09-07-00_47-YioCIxNMQos:9>`_

* [9.7.22] - `%F0%9F%9B%91LOW TIER GOD YOUTUBE LIVE STREAM%F0%9F%9B%91tlou_games_reactions_ (9_7_2022) 2022 09 07 23_54 E2uhTavjbWo:2 <https://odysee.com/@pneuth:b/%F0%9F%9B%91LOW-TIER-GOD-YOUTUBE-LIVE-STREAM%F0%9F%9B%91tlou_games_reactions_-(9_7_2022)-2022-09-07-23_54-E2uhTavjbWo:2>`_

* [9.9.22] - `%F0%9F%9B%91LOW TIER GOD YOUTUBE LIVE STREAM%F0%9F%9B%91Firday vibes_games_ect (9_9_2022) 2022 09 10 00_15 xF1qdWRmoY4:4 <https://odysee.com/@pneuth:b/%F0%9F%9B%91LOW-TIER-GOD-YOUTUBE-LIVE-STREAM%F0%9F%9B%91Firday-vibes_games_ect-(9_9_2022)-2022-09-10-00_15-xF1qdWRmoY4:4>`_

* [9.10.22] - `%F0%9F%9B%91LOW TIER GOD YOUTUBE LIVE STREAM%F0%9F%9B%91Firday vibes_games_ect (9_10_2022) 2022 09 11 01_18 VmLQIvkGiBg:9 <https://odysee.com/@pneuth:b/%F0%9F%9B%91LOW-TIER-GOD-YOUTUBE-LIVE-STREAM%F0%9F%9B%91Firday-vibes_games_ect-(9_10_2022)-2022-09-11-01_18-VmLQIvkGiBg:9>`_

* [9.11.22] - `%F0%9F%9B%91LOW TIER GOD YOUTUBE LIVE STREAM%F0%9F%9B%91Firday vibes_games_ect (9_10_2022) 2022 09 11 01_18 VmLQIvkGiBg:9 <https://odysee.com/@pneuth:b/%F0%9F%9B%91LOW-TIER-GOD-YOUTUBE-LIVE-STREAM%F0%9F%9B%91Firday-vibes_games_ect-(9_10_2022)-2022-09-11-01_18-VmLQIvkGiBg:9>`_

* [9.13.22] - `%F0%9F%9B%91LOW TIER GOD YOUTUBE LIVE STREAM%F0%9F%9B%91pnbrock_tekken8_jideon_games (9_13_2022) 2022 09 13 23_02 LtZMoaVdc3I:c <https://odysee.com/@pneuth:b/%F0%9F%9B%91LOW-TIER-GOD-YOUTUBE-LIVE-STREAM%F0%9F%9B%91pnbrock_tekken8_jideon_games-(9_13_2022)-2022-09-13-23_02-LtZMoaVdc3I:c>`_

* [9.14.22] - `%F0%9F%9B%91LOW TIER GOD YOUTUBE LIVE STREAM%F0%9F%9B%91Multiple games _etc (9_14_2022) 2022 09 15 00_15 93ffx06f4Ho:2 <https://odysee.com/@pneuth:b/%F0%9F%9B%91LOW-TIER-GOD-YOUTUBE-LIVE-STREAM%F0%9F%9B%91Multiple-games-_etc-(9_14_2022)-2022-09-15-00_15-93ffx06f4Ho:2>`_

* [9.15.22] - `%F0%9F%9B%91LOW TIER GOD YOUTUBE LIVE STREAM%F0%9F%9B%91SF6 REACTION_games (9_15_2022) 2022 09 15 23_06 bRadAfSTVz4:3 <https://odysee.com/@pneuth:b/%F0%9F%9B%91LOW-TIER-GOD-YOUTUBE-LIVE-STREAM%F0%9F%9B%91SF6-REACTION_games-(9_15_2022)-2022-09-15-23_06-bRadAfSTVz4:3>`_

* [9.16.22] - `LOW TIER GOD YOUTUBE LIVE STREAM TLOU2_SF6 STUFF_games (9_16_2022) Uk5oiMUkjHQ 1e78b122a68a31b7e04c800e5b57205e36bff7f6 :2 <https://odysee.com/@pneuth:b/LOW-TIER-GOD-YOUTUBE-LIVE-STREAM-TLOU2_SF6-STUFF_games-(9_16_2022)-Uk5oiMUkjHQ--1e78b122a68a31b7e04c800e5b57205e36bff7f6-:2>`_

* [9.17.22] - `%F0%9F%9B%91LOW TIER GOD YOUTUBE LIVE STREAM%F0%9F%9B%91TLOU2speed%E2%A7%B8games (9%E2%A7%B817%E2%A7%B82022) 2022 09 18 02_33 np7t_i QLrA :a <https://odysee.com/@pneuth:b/%F0%9F%9B%91LOW-TIER-GOD-YOUTUBE-LIVE-STREAM%F0%9F%9B%91TLOU2speed%E2%A7%B8games-(9%E2%A7%B817%E2%A7%B82022)-2022-09-18-02_33--np7t_i-QLrA-:a>`_

* [9.19.22] - `2022 09 19 19 38 50:8 <https://odysee.com/@pneuth:b/2022-09-19-19-38-50:8>`_

* [9.20.22] - `%F0%9F%9B%91LOW TIER GOD YOUTUBE LIVE STREAM%F0%9F%9B%91TLOUspeed_games_etc (9_20_2022) 2022 09 20 23_27 jkIbYK0EruI:5 <https://odysee.com/@pneuth:b/%F0%9F%9B%91LOW-TIER-GOD-YOUTUBE-LIVE-STREAM%F0%9F%9B%91TLOUspeed_games_etc-(9_20_2022)-2022-09-20-23_27-jkIbYK0EruI:5>`_

* [9.21.22] - `%F0%9F%9B%91LOW TIER GOD YOUTUBE LIVE STREAM%F0%9F%9B%91_games_etc (9_21_2022) 2022 09 22 01_34 dKnCasxuddg:f <https://odysee.com/@pneuth:b/%F0%9F%9B%91LOW-TIER-GOD-YOUTUBE-LIVE-STREAM%F0%9F%9B%91_games_etc-(9_21_2022)-2022-09-22-01_34-dKnCasxuddg:f>`_

* [9.22.22] - `%F0%9F%9B%91LOW TIER GOD YOUTUBE LIVE STREAM%F0%9F%9B%91_games_etc (9_23_2022) 2022 09 23 03_14 Wa2R7auCqxw:3 <https://odysee.com/@pneuth:b/%F0%9F%9B%91LOW-TIER-GOD-YOUTUBE-LIVE-STREAM%F0%9F%9B%91_games_etc-(9_23_2022)-2022-09-23-03_14-Wa2R7auCqxw:3>`_

* [9.23.22] - `%F0%9F%9B%91LOW TIER GOD YOUTUBE LIVE STREAM%F0%9F%9B%91_games_reactions etc (9_23_2022) 2022 09 23 23_34 cVC2cFFAgfo:a <https://odysee.com/@pneuth:b/%F0%9F%9B%91LOW-TIER-GOD-YOUTUBE-LIVE-STREAM%F0%9F%9B%91_games_reactions-etc-(9_23_2022)-2022-09-23-23_34-cVC2cFFAgfo:a>`_

* [9.24.22] - `%F0%9F%9B%91LOW TIER GOD YOUTUBE LIVE STREAM%F0%9F%9B%91_games_reactions etc (9_24_2022) 2022 09 25 01_49 vwLxQgv7vrQ:c <https://odysee.com/@pneuth:b/%F0%9F%9B%91LOW-TIER-GOD-YOUTUBE-LIVE-STREAM%F0%9F%9B%91_games_reactions-etc-(9_24_2022)-2022-09-25-01_49-vwLxQgv7vrQ:c>`_

* [9.25.22] - `%F0%9F%9B%91LOW TIER GOD YOUTUBE LIVE STREAM%F0%9F%9B%91_games_reactions etc (9_25_2022) 2022 09 26 00_56 zSdIv_Y5AEQ:8 <https://odysee.com/@pneuth:b/%F0%9F%9B%91LOW-TIER-GOD-YOUTUBE-LIVE-STREAM%F0%9F%9B%91_games_reactions-etc-(9_25_2022)-2022-09-26-00_56-zSdIv_Y5AEQ:8>`_

* [9.26.22] - `%F0%9F%9B%91LOW TIER GOD YOUTUBE LIVE STREAM%F0%9F%9B%91_games_reactions etc (9_26_2022) 2022 09 26 23_39 r7Qxh5fQRiI:f <https://odysee.com/@pneuth:b/%F0%9F%9B%91LOW-TIER-GOD-YOUTUBE-LIVE-STREAM%F0%9F%9B%91_games_reactions-etc-(9_26_2022)-2022-09-26-23_39-r7Qxh5fQRiI:f>`_

* [9.27.22] - `%F0%9F%9B%91LOW TIER GOD YOUTUBE LIVE STREAM%F0%9F%9B%91_multi_tekken7_rumble_reactions etc (9_27_2022) 2022 09 28 00_06 PCHUFXT7g4g:3 <https://odysee.com/@pneuth:b/%F0%9F%9B%91LOW-TIER-GOD-YOUTUBE-LIVE-STREAM%F0%9F%9B%91_multi_tekken7_rumble_reactions-etc-(9_27_2022)-2022-09-28-00_06-PCHUFXT7g4g:3>`_

* [9.28.22] - `%F0%9F%9B%91LOW TIER GOD YOUTUBE LIVE STREAM%F0%9F%9B%91_multi_tekken7_rumble_ etc (9_28_2022) 2022 09 29 00_42 n8mmspPt_xE:3 <https://odysee.com/@pneuth:b/%F0%9F%9B%91LOW-TIER-GOD-YOUTUBE-LIVE-STREAM%F0%9F%9B%91_multi_tekken7_rumble_-etc-(9_28_2022)-2022-09-29-00_42-n8mmspPt_xE:3>`_

* [9.30.22] - `%F0%9F%9B%91LOW TIER GOD YOUTUBE LIVE STREAM%F0%9F%9B%91etc_discord is live_games (9_30_2022) 2022 09 30 23_22 v66sSrPUhJU:e <https://odysee.com/@pneuth:b/%F0%9F%9B%91LOW-TIER-GOD-YOUTUBE-LIVE-STREAM%F0%9F%9B%91etc_discord-is-live_games-(9_30_2022)-2022-09-30-23_22-v66sSrPUhJU:e>`_

October 2022
-------------

* [10.1.22] - `%F0%9F%9B%91LOW TIER GOD YOUTUBE LIVE STREAM%F0%9F%9B%91etc_discord is live_friday games_reaction (10_1_2022) 2022 10 02 01_02 e9X5e MRHXw:c <https://odysee.com/@pneuth:b/%F0%9F%9B%91LOW-TIER-GOD-YOUTUBE-LIVE-STREAM%F0%9F%9B%91etc_discord-is-live_friday-games_reaction-(10_1_2022)-2022-10-02-01_02-e9X5e-MRHXw:c>`_

* [10.2.22] - `%F0%9F%9B%91LOW TIER GOD YOUTUBE LIVE STREAM%F0%9F%9B%91etc_discord is live_ games_reactions (10_2_2022) 2022 10 02 23_42 eGW0CDv fNs:c <https://odysee.com/@pneuth:b/%F0%9F%9B%91LOW-TIER-GOD-YOUTUBE-LIVE-STREAM%F0%9F%9B%91etc_discord-is-live_-games_reactions-(10_2_2022)-2022-10-02-23_42-eGW0CDv-fNs:c>`_

* [10.3.22] - `%F0%9F%9B%91LOW TIER GOD YOUTUBE LIVE STREAM%F0%9F%9B%91etc_discord is live_ games_tekken (10_3_2022) 2022 10 04 01_09 54KOeMYUp_c:5 <https://odysee.com/@pneuth:b/%F0%9F%9B%91LOW-TIER-GOD-YOUTUBE-LIVE-STREAM%F0%9F%9B%91etc_discord-is-live_-games_tekken-(10_3_2022)-2022-10-04-01_09-54KOeMYUp_c:5>`_

* [10.4.22] - `%F0%9F%9B%91LOW TIER GOD YOUTUBE LIVE STREAM%F0%9F%9B%91NO SF6 BETA CODE (10_4_2022) 2022 10 04 23_46 ehE2vPEs2BI:4 <https://odysee.com/@pneuth:b/%F0%9F%9B%91LOW-TIER-GOD-YOUTUBE-LIVE-STREAM%F0%9F%9B%91NO-SF6-BETA-CODE-(10_4_2022)-2022-10-04-23_46-ehE2vPEs2BI:4>`_

* [10.5.22] - `%F0%9F%9B%91LOW TIER GOD YOUTUBE LIVE STREAM%F0%9F%9B%91NO SF6 BETA CODE (10_5_2022) 2022 10 06 01_51 Nq4bWInzkrw:7 <https://odysee.com/@pneuth:b/%F0%9F%9B%91LOW-TIER-GOD-YOUTUBE-LIVE-STREAM%F0%9F%9B%91NO-SF6-BETA-CODE-(10_5_2022)-2022-10-06-01_51-Nq4bWInzkrw:7>`_

* [10.6.22] - `%F0%9F%9B%91LOW TIER GOD YOUTUBE LIVE STREAM%F0%9F%9B%91 SF6 BETA LAUNCH STREAM WAIT PARTY (10_6_2022) 2022 10 06 23_04 mx8MDcp1bCE:8 <https://odysee.com/@pneuth:b/%F0%9F%9B%91LOW-TIER-GOD-YOUTUBE-LIVE-STREAM%F0%9F%9B%91-SF6-BETA-LAUNCH-STREAM-WAIT-PARTY-(10_6_2022)-2022-10-06-23_04-mx8MDcp1bCE:8>`_

* [10.7.22] - `%F0%9F%9B%91LOW TIER GOD YOUTUBE LIVE STREAM%F0%9F%9B%91 SF6 BETA LAUNCH day 2 (10_6_2022) 2022 10 08 00_44 sKkwbbviOSE:0 <https://odysee.com/@pneuth:b/%F0%9F%9B%91LOW-TIER-GOD-YOUTUBE-LIVE-STREAM%F0%9F%9B%91-SF6-BETA-LAUNCH-day-2-(10_6_2022)-2022-10-08-00_44-sKkwbbviOSE:0>`_

* [10.9.22] - `%F0%9F%9B%91LOW TIER GOD YOUTUBE LIVE STREAM%F0%9F%9B%91 SF6 BETA LAUNCH day 2 (10_9_2022) 2022 10 10 00_19 rbzHuc0Fxm0:e <https://odysee.com/@pneuth:b/%F0%9F%9B%91LOW-TIER-GOD-YOUTUBE-LIVE-STREAM%F0%9F%9B%91-SF6-BETA-LAUNCH-day-2-(10_9_2022)-2022-10-10-00_19-rbzHuc0Fxm0:e>`_

* [10.10.22] - `%F0%9F%9B%91LOW TIER GOD YOUTUBE LIVE STREAM%F0%9F%9B%91 BACK TO REGULAR PROGRAMMING (10_10_2022) 2022 10 11 00_00 9G33_97kAHo:5 <https://odysee.com/@pneuth:b/%F0%9F%9B%91LOW-TIER-GOD-YOUTUBE-LIVE-STREAM%F0%9F%9B%91-BACK-TO-REGULAR-PROGRAMMING-(10_10_2022)-2022-10-11-00_00-9G33_97kAHo:5>`_

* [10.11.22] - `%F0%9F%9B%91LOW TIER GOD YOUTUBE LIVE STREAM%F0%9F%9B%91 GAMES AND MORE (10_11_2022) 2022 10 11 23_46 NCM5sLqwH9A:7 <https://odysee.com/@pneuth:b/%F0%9F%9B%91LOW-TIER-GOD-YOUTUBE-LIVE-STREAM%F0%9F%9B%91-GAMES-AND-MORE-(10_11_2022)-2022-10-11-23_46-NCM5sLqwH9A:7>`_

* [10.12.22, 1 chip challenge stream] - `%F0%9F%9B%91LOW TIER GOD YOUTUBE LIVE STREAM%F0%9F%9B%91 GAMES AND MORE (10_12_2022) 2022 10 12 23_28 UdDsIUmphyc:d <https://odysee.com/@pneuth:b/%F0%9F%9B%91LOW-TIER-GOD-YOUTUBE-LIVE-STREAM%F0%9F%9B%91-GAMES-AND-MORE-(10_12_2022)-2022-10-12-23_28-UdDsIUmphyc:d>`_

* [10.13.22] - `%F0%9F%9B%91LOW TIER GOD YOUTUBE LIVE STREAM%F0%9F%9B%91 tekken_toomba_etc (10_13_2022) 2022 10 14 01_39 4Ff1ft3XiHk:9 <https://odysee.com/@pneuth:b/%F0%9F%9B%91LOW-TIER-GOD-YOUTUBE-LIVE-STREAM%F0%9F%9B%91-tekken_toomba_etc-(10_13_2022)-2022-10-14-01_39-4Ff1ft3XiHk:9>`_

* [10.14.22] - `%F0%9F%9B%91LOW TIER GOD YOUTUBE LIVE STREAM%F0%9F%9B%91 tekken_reactions_toomba (10_14_2022) 2022 10 14 22_52 nwHOtC4WkA8:f <https://odysee.com/@pneuth:b/%F0%9F%9B%91LOW-TIER-GOD-YOUTUBE-LIVE-STREAM%F0%9F%9B%91-tekken_reactions_toomba-(10_14_2022)-2022-10-14-22_52-nwHOtC4WkA8:f>`_

* [10.16.22] - `%F0%9F%9B%91LOW TIER GOD YOUTUBE LIVE STREAM%F0%9F%9B%91 tekken_reactions_toomba (10_16_2022) 2022 10 16 23_54 _PhUj9iDn c:c <https://odysee.com/@pneuth:b/%F0%9F%9B%91LOW-TIER-GOD-YOUTUBE-LIVE-STREAM%F0%9F%9B%91-tekken_reactions_toomba-(10_16_2022)-2022-10-16-23_54-_PhUj9iDn-c:c>`_

* [10.17.22] - `%F0%9F%9B%91LOW TIER GOD YOUTUBE LIVE STREAM%F0%9F%9B%91 tekken_scorn_toomba (10_17_2022) 2022 10 17 23_23 KpiWPqlOz7o:b <https://odysee.com/@pneuth:b/%F0%9F%9B%91LOW-TIER-GOD-YOUTUBE-LIVE-STREAM%F0%9F%9B%91-tekken_scorn_toomba-(10_17_2022)-2022-10-17-23_23-KpiWPqlOz7o:b>`_

* [10.18.22] - `%F0%9F%9B%91LOW TIER GOD YOUTUBE LIVE STREAM%F0%9F%9B%91 tekken_scorn_games (10_18_2022) 2022 10 19 00_10 N6w3p5UKYYI:1 <https://odysee.com/@pneuth:b/%F0%9F%9B%91LOW-TIER-GOD-YOUTUBE-LIVE-STREAM%F0%9F%9B%91-tekken_scorn_games-(10_18_2022)-2022-10-19-00_10-N6w3p5UKYYI:1>`_

* [10.19.22] - `%F0%9F%9B%91LOW TIER GOD YOUTUBE LIVE STREAM%F0%9F%9B%91 _scorn_etc (10_19_2022) 2022 10 20 01_22 bzakWXkldl8:6 <https://odysee.com/@pneuth:b/%F0%9F%9B%91LOW-TIER-GOD-YOUTUBE-LIVE-STREAM%F0%9F%9B%91-_scorn_etc-(10_19_2022)-2022-10-20-01_22-bzakWXkldl8:6>`_

* [10.20.22] - `%F0%9F%94%B4LOW TIER GOD YOUTUBE LIVE STREAM%F0%9F%94%B4 tekken_GOTHAM KNIGHTS (10_20_2022) 2022 10 20 23_30 9n4geLyRVa4:a <https://odysee.com/@pneuth:b/%F0%9F%94%B4LOW-TIER-GOD-YOUTUBE-LIVE-STREAM%F0%9F%94%B4-tekken_GOTHAM-KNIGHTS-(10_20_2022)-2022-10-20-23_30-9n4geLyRVa4:a>`_

* [10.21.22] - `%F0%9F%94%B4LOW TIER GOD YOUTUBE LIVE STREAM%F0%9F%94%B4 tekken_GOTHAM KNIGHTS_ETC (10_21_2022) 2022 10 22 01_20 dN2Ac_xh5fw:2 <https://odysee.com/@pneuth:b/%F0%9F%94%B4LOW-TIER-GOD-YOUTUBE-LIVE-STREAM%F0%9F%94%B4-tekken_GOTHAM-KNIGHTS_ETC-(10_21_2022)-2022-10-22-01_20-dN2Ac_xh5fw:2>`_

* [10.22.22] - `%F0%9F%94%B4LOW TIER GOD YOUTUBE LIVE STREAM%F0%9F%94%B4 A saturday stream (10_22_2022) 2022 10 23 02_11 pCStgC0A2Dg:5 <https://odysee.com/@pneuth:b/%F0%9F%94%B4LOW-TIER-GOD-YOUTUBE-LIVE-STREAM%F0%9F%94%B4-A-saturday-stream-(10_22_2022)-2022-10-23-02_11-pCStgC0A2Dg:5>`_

* [10.24.22] - `%F0%9F%94%B4LOW TIER GOD YOUTUBE LIVE STREAM%F0%9F%94%B4 monday_gotham_tekken_others (10_23_2022) 2022 10 24 23_31 _SDy0q__E_A:1 <https://odysee.com/@pneuth:b/%F0%9F%94%B4LOW-TIER-GOD-YOUTUBE-LIVE-STREAM%F0%9F%94%B4-monday_gotham_tekken_others-(10_23_2022)-2022-10-24-23_31-_SDy0q__E_A:1>`_

[10.25.22, 2 parts]

* [DALE CHATS WITH DESTINY] - `%F0%9F%94%B4LOW TIER GOD YOUTUBE LIVE STREAM%F0%9F%94%B4 tuesday_destiny call_etc (10_23_2022) 2022 10 25 20_38 5BMUQYHx 7s:c <https://odysee.com/@pneuth:b/%F0%9F%94%B4LOW-TIER-GOD-YOUTUBE-LIVE-STREAM%F0%9F%94%B4-tuesday_destiny-call_etc-(10_23_2022)-2022-10-25-20_38-5BMUQYHx-7s:c>`_

* [https://odysee.com/@pneuth:b/%F0%9F%94%B4LOW-TIER-GOD-YOUTUBE-LIVE-STREAM%F0%9F%94%B4-tuesday%E2%A7%B8reactions-games--(10%E2%A7%B823%E2%A7%B82022)-2022-10-25-22_54--_pW-_sLSDP0-:b] - `%F0%9F%94%B4LOW TIER GOD YOUTUBE LIVE STREAM%F0%9F%94%B4 tuesday%E2%A7%B8reactions games (10%E2%A7%B823%E2%A7%B82022) 2022 10 25 22_54 _pW _sLSDP0 :b <https://odysee.com/@pneuth:b/%F0%9F%94%B4LOW-TIER-GOD-YOUTUBE-LIVE-STREAM%F0%9F%94%B4-tuesday%E2%A7%B8reactions-games--(10%E2%A7%B823%E2%A7%B82022)-2022-10-25-22_54--_pW-_sLSDP0-:b>`_

* [10.26.22] - `%F0%9F%94%B4LOW TIER GOD YOUTUBE LIVE STREAM%F0%9F%94%B4 wed_abrubt (10_23_2022) 2022 10 27 01_37 a4LFMppwsRY:4 <https://odysee.com/@pneuth:b/%F0%9F%94%B4LOW-TIER-GOD-YOUTUBE-LIVE-STREAM%F0%9F%94%B4-wed_abrubt-(10_23_2022)-2022-10-27-01_37-a4LFMppwsRY:4>`_

* [10.27.22] - `%F0%9F%94%B4LOW TIER GOD YOUTUBE LIVE STREAM%F0%9F%94%B4 thurs_like and comment all vids (10_27_2022) 2022 10 28 00_11 H5ZmrII9l4o:4 <https://odysee.com/@pneuth:b/%F0%9F%94%B4LOW-TIER-GOD-YOUTUBE-LIVE-STREAM%F0%9F%94%B4-thurs_like-and-comment-all-vids-(10_27_2022)-2022-10-28-00_11-H5ZmrII9l4o:4>`_

* [10.28.22, DISASTER DRESS-UP STREAM] - `%F0%9F%94%B4LOW TIER GOD YOUTUBE LIVE STREAM%F0%9F%94%B4 _horror_dress up_like and comment all vids (10_28_2022) 2022 10 28 23_14 Q8Ns9J9xMW4:c <https://odysee.com/@pneuth:b/%F0%9F%94%B4LOW-TIER-GOD-YOUTUBE-LIVE-STREAM%F0%9F%94%B4-_horror_dress-up_like-and-comment-all-vids-(10_28_2022)-2022-10-28-23_14-Q8Ns9J9xMW4:c>`_

* [10.31.22] - `%F0%9F%94%B4LOW TIER GOD YOUTUBE LIVE STREAM%F0%9F%94%B4 %E2%A7%B8games%E2%A7%B8like and comment all vids (10%E2%A7%B831%E2%A7%B82022)  e74d6bec5dd116570931380c930beb5be6cbe8bd :9 <https://odysee.com/@pneuth:b/%F0%9F%94%B4LOW-TIER-GOD-YOUTUBE-LIVE-STREAM%F0%9F%94%B4-%E2%A7%B8games%E2%A7%B8like-and-comment-all-vids-(10%E2%A7%B831%E2%A7%B82022)---e74d6bec5dd116570931380c930beb5be6cbe8bd-:9>`_

November 2022
-------------

* [11.1.22] - `%F0%9F%94%B4LOW TIER GOD YOUTUBE LIVE STREAM%F0%9F%94%B4 %E2%A7%B8topics%E2%A7%B8games%E2%A7%B8like and comment all vids (11%E2%A7%B81%E2%A7%B82022) MntF8KvqHW4 :3 <https://odysee.com/@pneuth:b/%F0%9F%94%B4LOW-TIER-GOD-YOUTUBE-LIVE-STREAM%F0%9F%94%B4-%E2%A7%B8topics%E2%A7%B8games%E2%A7%B8like-and-comment-all-vids-(11%E2%A7%B81%E2%A7%B82022)--MntF8KvqHW4-:3>`_

[11.2.22, DALE SHOWS PORN ON STREAM]

[its at the end of this vod, I BLURRED IT BECAUSE IT allegedly IS CP]

* [https://odysee.com/@pneuth:b/-CENSORED--%F0%9F%94%B4LOW-TIER-GOD-YOUTUBE-LIVE-STREAM%F0%9F%94%B4-late%E2%A7%B8topics%E2%A7%B8games%E2%A7%B8like-and-comment-all-vids-(11%E2%A7%B82%E2%A7%B82022)--i4QAegeb0pk-:d] - `CENSORED %F0%9F%94%B4LOW TIER GOD YOUTUBE LIVE STREAM%F0%9F%94%B4 late%E2%A7%B8topics%E2%A7%B8games%E2%A7%B8like and comment all vids (11%E2%A7%B82%E2%A7%B82022) i4QAegeb0pk :d <https://odysee.com/@pneuth:b/-CENSORED--%F0%9F%94%B4LOW-TIER-GOD-YOUTUBE-LIVE-STREAM%F0%9F%94%B4-late%E2%A7%B8topics%E2%A7%B8games%E2%A7%B8like-and-comment-all-vids-(11%E2%A7%B82%E2%A7%B82022)--i4QAegeb0pk-:d>`_

